 bikin emosi emang urusan sama kalo bs ganti sih mending ganti aja sama first media better lah atau biznet skalian.,negative
 tf biznet area lebaksiu jaringannya sudah ada belum? barangkali ada yang punya nomer hp cs biznet tegal boleh minta,neutral
gokar! klo mau pasang wifi biznet atau myrepublic tuh bisa ga ya daerah kopel?,neutral
 tf maaf mau tanya daerah balamoa bisa dipasangin wifi biznet first media apa engga? makasih,neutral
 biznet biaya pasangnya mahal,negative
kalian ada yg pake biznet gag? dalam satu bulan kendalanya apa aja?,neutral
gua baru sadar di pos daerah gua pasang wifi udah gitu biznet lg. udahmah gratis jarak luas jangkauan meter,positive
biznet is hiring source teman yang kerja di biznet ,neutral
jam jam segini nih biznet kenceng banget ,positive
hari ini berenti first media ganti biznet. ,positive
biznet error dari kemaren fwewfiqw,negative
mulai jadi jamaah biznet home cc ,neutral
pdg! ndeh libak wak samo indihoi capeklah biznet atau ndak stroomnet kamari ka rumah wak! fup abih tuh ndak stabil loh koneksinyo huft ,negative
biznet jarang gangguang sekalinya gangguan menyebalkan ,negative
bukan kaleng kaleng biznet ini. upload yg tadinya cuma . mbps bisa jadi segini ,positive
mendukung aktivitas remote working di bali biznet telah membuka kantor pusat bali di kawasan karang mas estate di jimbaran atau lebih dikenal dengan kawasan ayana ,positive
wkwkwkwkwkwkkw biznet vs first media. dadah first media gue berhenti berlangganan selamanya. ,positive
lumayan berat sih. kalau gak bisa live penggunaan kuota internet menurun. pembelian kuota berkurang provider yg merasa dirugikan. rcti against telkomsel indosat xl smartfren indihome biznet myrepulic lanjutin lagi gays. ,neutral
setelah drama lag sepanjang bulan. akhirnya balik mitik lagi juga. terimakasih indihome berkat kamu aku sadar bahwa ternyata memang biznet yang terbaik. ,positive
biznet kenapa seh dari kmrn malem lho ya. di dlm kamar kosan yo gaiso nggarap soale raono sinyal. ac ne yo mung koyo kipas. ono ono wae peh jaan jumatsambat ,negative
ini apaansi gue buka web apa masuknya homepage dikira bagus kali homepage lo tampilan aneh kaya web tahun an. gue pake layanan lo juga kaena terpaksa karena biznet dan yg lain ga masuk cluster rumah gue. ,negative
konsultasikan segera kendala transformasi digital kepada kami melalui sales dengan pemilihan platform kolaborasi yang tepat agar dapat menghasilkan kinerja yang lebih efisien dan produktif untuk bisnis anda. platformkolaborasi pakebiznet biznetgiocloud ,neutral
andaikan bekasi pinggiran dapet biznet,neutral
wkwkw evos turnamen ngelag lagian pake axis gakayak onic biznet,negative
kami telah memilih tools monitoring yang dapat anda gunakan untuk memantau infrastruktur cloud. jika anda membutuhkan layanan monitoring segera hubungi kami di sales kami siap memberikan solusi terbaik untuk kebutuhan anda. biznetgiocloud grafana zabbix ,neutral
the most potential provider is only indihome biznet due to their coverage and depend on luck too. the goal is be authentic and you got the sales number jgn terkesan seperti request pemasangan biasa. bilang bahwa lo tau memang gak tercover tapi apakah bisa dibantu. gitu.,neutral
biznet jangan ngadi ngadi ,negative
complain ke biznet jam segini keliatan banget nganggurnya gak sih,negative
cicurug udh ada biznet pen ganti fix cape sama indihome wkwk,positive
ganti biznet jak pu rumah kau kan daerah kote bse,neutral
iya pis tp udah bener pagi ini makanya pake biznet aja eh,positive
biznet kok lemot bgt amjit,negative
 dibilang biznet aja hahah,neutral
ayo dong biznet mau ngerjain tugas ini. kuota tinggal dikit pula,neutral
wkwkwkwkwkwkkw badut meremehkan biznet ternyata malah cepetan biznet timbang byu,positive
info provider internet rumah di pasuruan selain indihome dan biznet dong gaiss.,neutral
gila ya biznet keren banget anjir gue download episode drakor ga sampe semenit. pengen salim sama biznet,positive
biznet lemot juga? hahahah.. ada aja dah.,negative
besok pagi krs tapi biznet lagi labil bgt gini duh,negative
 jbrfess ada yg pake wifi biznet? lagi gangguan gak seh dari kemarin gabisa wifinyaa,negative
indehoi lemot banget banget mending pake biznet!!,positive
gue belom nonton fkbu latest ep gegara biznet bye,negative
biznet pake gangguan segala,negative
pamulang aja bisa kena biznet masa cibubur kaga sabi dah,negative
biznet kini punya kantor pusat bali ,positive
bagi yang mau berlangganan internet super cepat hati hati menggunakan biznet ..jangan sia sia kan uang anda dan emosi anda ..layanan biznet super jelek internet saya putus tanpa ada penanganan,negative
punten biznet emang lagi gangguan ya? biznet biznethome biznetnetwork,neutral
kenapa biznet jd lemot kieu anjeng,negative
biznet nyari ribut bgt beberapa hari gak bisa dipake elah,negative
aku udah terbiase pakai biznet sekalinyaa dirumah kenak indihome langsong terasee ke garry an nye,negative
 wihh backed by biznet?,neutral
biznet lagi ngantuk apa hp gue aja ni daritadi wifi aja futus futus,negative
maunya say tapi apa daya ga cover jaringan biznet ke rumah,negative
aku pakai biznet trus lemot juga,negative
biznet sama mnc play aja ga ke cover area rumah gue tailah masa mau sampe mati pake indihome ini,negative
biznet geus paling bener mah bil,positive
moots yang pake biznet kalian gangguan juga gak?,neutral
kok iuran ak kek banyak ya tahun ni biznet netflix halo belom lagi zin member bulanan. bye kak melihat disney ,neutral
udah setengah jam ni biznet gabisa. dah direstart sama aja ga ada perubahan cok,negative
biznet tumben malem malem pingnya jumping biasanya dibawah ms trus kalo jam segini,negative
kalo dirumahku uda ada biznet aja ganti sumpa,positive
dukung remote working di bali biznet hadirkan koneksi internet kelas dunia ,positive
epos jgn pake axis mangkannya pake biznet biar ga ngelag heu,negative
kira kira admin indihum pake provider apa ya? mnc? firstmedia? biznet? myrepublic?,neutral
ya allah ya rabbi he biznet tolong muhasabah diri anda ini gak bisa dipake wifi anda heyy apa perlu saya panggilkan tretan muslim dan coki pardede,negative
dan karena myrep biznet mncplay xlhome coverage nya blm sampe rumah terpaksa pake firstmed daripada indie kata orang ,neutral
 mas pradita keluar biznet aja bareng kita anak twitter bikin isp sendiri.,neutral
yang pake biznet eror ga sih?,neutral
 kle jd gini kan aku baru pasang wifi biznet kemarin di rumah nah tiba tiba skrg tiap connect wifinya gk bs terhubung ke internet udah coba restart modem sama tanya adminnya tp blm bs jg. apa ada yg ngalamin hal yg sama juga gak? suksma titipan ,negative
yang area purwokerto ada yang pake biznet?gimana rate jaringan inetnya ? berapa?,neutral
ya ampun babeh ke php promo wifi fm eh malah udah manggil mas indigo buat pasang di rumah. maunya biznet atau citranet aja duhduhduh.,neutral
ml! makanya sponsor tuh biznet jangan axis,positive
haloo min biznet udah masuk kabupaten banyumas atau baru cuma di purwokerto aja ya min?,neutral
apakah saya harus pindah biznet agar supaya star point saya tidak menurun trs grgr indihum hm,neutral
ada yang mau tawarin pasang inet dirumah ga ya? biznet kalau bisa kalau yang lain mencangkup area saya reply aja dulu.,neutral
biznet tiap jam segini lambat banget kampang,negative
baru ketauan kalo biznet sama myrep gak kecover,negative
down sama up nya indihomo sangat njeglek sekali kalo pengen kecepatan jangan pake indohomo setau ku biznet yang kecepatannya ga tau juga mnc yang di maksud itu kecepatan download sama upload masing sama semisal sama mbps,positive
terbaik emang ! ganti biznet seru kali yaa ,positive
mau nanya dong disini ada yang pake biznet ga ya?,neutral
tanggapan biznet untuk surat pembaca bapak andy tanojo ,neutral
 ada gak ya peta area jangkauan biznet? butuh ngecek nih,neutral
 jadi tetanggaan gak kita? katanya sih biznet dah masuk salesnya suka nongkrong depan rumah gw . ntar gw liat dan tanya lagi deh kalo ada. gw juga mau pasang soalnya,neutral
pasti dia pake biznet sekali pencet ke send lain kali zara coba pake bali fiber,neutral
kalian tim apa? biznet atau indihome?,neutral
dengan mengintegrasikan zabbix dan grafana anda bisa mendapatkan visualisasi dan fungsionalitas data monitoring yang lebih optimal. lalu bagaimana cara mengintegrasikan zabbix dan grafana? klik link berikut untuk mengetahui langkah langkahnya. ,neutral
biznet buka kantor pusat di bali ,positive
hahahaha.. abis rumah narik kabel jaringan biznet pertama di jalan gue kayaknya pagi ini biznet langsung buka booth jualan di depan yang minat tanya tanya buat areanya silakan langsung ke ,neutral
frustrasi level dg first media tapi ga punya pilihan lain selain pake layanannya dia. udah kontak mr cbn biznet coveragenya gak sampe perumahan gue semua sedih bats,negative
 rek onok seng duwe pricelist e wifi biznet gak? paling murah per bulan kenek piro? makasii,neutral
yuk main fall guys gantian tiap kalah isep pake biznet pasti jarang disconnect.,positive
 apapun daerahnya internetnya biznet,positive
tau ga meng listrik mati padahal di aku ga mati jadi wifiku ga bisa dipake biznet??!! kok mati listrik anjim di pusatnya,negative
oxygen sering nge leg kagak? ? biznet daerah puri bapuk anjir,negative
ngeliat twit ompir yang ini makin tersadar betapa buruknya isp indihong biznet x putus sebulan udah jadi masalah besar. sementara isp yang gue pakai pernah putus lebih dari x dalam sehari dan terjadi selama seminggu,negative
 halo sore. terima kasih kembali untuk informasinya ya dan selamat menikmati layanan biznet kembali. trims ros,neutral
 ini biznet harusnya bikin web app buat semacam petisi sambungkan kompleks saya ke biznet. nanti tinggal cari dukungan warga sekitar klo dah ada petisinya. lempar ke group wa rt minta ikut isi.,neutral
 hi selamat malam. ada informasi yang dapat kami bantu perihal layanan biznet? trims bnu,neutral
 edan ini baru namanya sekolah powered by biznet,positive
to because pelan lagi nih internet nya ada apa lagi sih ni biznet biznet in indonesia speed performance outages and user reviews fing internet biznet via ,negative
biznet buka kantor pusat di bali ,positive
biznet bagus ga si gue pengen ganti aja,neutral
 halo selamat pagi. mohon diinformasikan id pelanggannya melalui dm ya agar kami bantu pengecekkan lebih lanjut. trims afn,neutral
halo kak mau tanya apakah biznet kediri lagi gangguan? padahal wifi nya sudah di restart tp tetep gakbisa kenapa ya? ,neutral
edan koe iki lemot bianget cuk! ramasok eh daerah janti udah kecover belom? tak pindah situ aja kalo udah,neutral
 hi selamat malam. untuk saat ini kamu berada di paket layanan biznet home internet up to mbps dengan masa aktif berakhir sampai dengan . mengenai upgrade layanannya bisa dilakukan jika masa aktif layanan saat ini sudah berakhir. thanks ltf,neutral
selain destinasi wisata dunia bali juga menjadi destinasi remote working ,neutral
biznet buka kantor pusat di bali destinasi favorit untuk remote working kelas dunia ,positive
 hi selamat malam. terima kasih atas ketertarikan kamu pakebiznet. untuk layanan terendah saat ini hanya tersedia di biznet home internet b up to mbps untuk wilayah pulau jawa batam dan bali. thanks ltf,neutral
to udah bermasalah lagi nih inetnya udah seminggu selalu bermasalah mulai jam perbaiki segera biznet in indonesia speed performance outages and user reviews fing internet biznet via ,negative
to kenapa sih bbrp hari ini mulai jam siang inetnya selalu bermasalah pelan sekali biznet in indonesia speed performance outages and user reviews fing internet biznet via ,negative
biznet buka kantor pusat di bali destinasi favorit untuk remote working kelas dunia ,positive
enak banget anjir dulu nyari biznet aja susah bgt anjinq wifi id cumang deket ama wakesek sekarang ada di kelas ,positive
pengen lagi ,neutral
gada akhlak admin biznet ,negative
nangis lah biznet cuma sampai ungaran ,negative
oke lain kali aing aya proyekan kudu punten heula ka biznet myrepublic mncplay indihome dan lain lain sok sebutkeun isp na hiji .. ,neutral
wifi masjid pake biznet ga kaya rumah w indihouse bawaannya jadi pen ke masjid mulu ,positive
otw ngajoke proposal neng biznet ,neutral
kemana mana selalu pakai helm semenjak kakak kerja disana mungkin tahun ya? aku gak mau diangkat jadi brand ambassadornya min? lumayan lho tiap hari aku promosiin biznet kemana pun aku pergi ,positive
tambah yakin buat makai biznet tapi belum masuk ,neutral
sejak didirikan pada tahun wordpress telah menguasai kurang lebih market cms di seluruh dunia. apakah anda pengguna setia wordpress? tulis di kolom komentar apa hal yang menarik dari wordpress menurut anda! biznetgiocloud wordpress ,neutral
lanjutkan kestabilannya.. biznet speedtest biznethome ,positive
hallo selamat malam min apakah biznet sedang gangguan lagi utk area denpasar? ping di tempat saya hancur naik turun. kita game center ya min jd agak terganggu dengan kondisi koneksi saat ini yg terjadi. id ,negative
biznet dukung belajar dari rumah ,positive
selamat datang di indonesia google cloud sebagai official partner biznet gio siap mendukung inovasi dan transformasi bisnis dengan solusi pengelolaan multi cloud dan infrastruktur terbaik di indonesia. cloudforindonesia biznetgio googlecloud indonesia ,positive
teu di goblog goblog ge iyeu emang goblog menit sakali buffering aing mun boga duit ge ganti na kanu biznet atau myrepublic ulah asli ulah make indihome bangsat ,negative
ada yang pake biznet di rumahnya? mau tanya tanya dong ,neutral
kami merangkum beberapa alasan mengapa wordpress sangat diminati untuk membantu banyak orang dalam membuat website. jalankan wordpress anda dengan neo dedicated hosting yang dilengkapi dengan plesk wordpress toolkit. informasi lengkap klik link ,neutral
speed real indihome mbps setelah kena fup jauh banget kepotong speednya mudahan isp kek biznet bisa segera ada di tarakan yakin dah orang pada ganti semua dah gemes sama fup gini ,negative
nikmati fitur lengkap plesk wordpress toolkit dengan berlangganan neo dedicated hosting hanya dengan rp . bulan. dengan spesifikasi cloud server core gb ram dan gb storage website anda berjalan dengan cepat dan andal. registrasi sekarang di ,neutral
kita tidak butuh netflix di telkom karena saya pakai biznet,positive
biznet metronet! broadband internet terbaik untuk kantor dan usaha? ,positive
ada yg make wifi biznet ga? drop testi dong,neutral
webnya di protect biznet ,neutral
kalau mau pasang biznet di rumah biaya apa aja sih yang harus kamu bayarkan? video ini membahas dengan lengkap biaya apa saja yang harus dibayarkan untuk berlangganan biznet home. ,neutral
bagaimana caranya agar rumahmu masuk dalam coverage area biznet? video ini akan membahas bagaimana biznet membangun infrastruktur jaringan dalam suatu area dari nol sampai internet aktif.,neutral
gila mak gue gamau ganti biznet apa,neutral
ena bner pake biznet wkwk,positive
kalo ada biznet gw pasang biznet dah ini,positive
mutual gue kira ada yang pake biznet gaa ya? mau nanya soalnyaa,neutral
biznet worth it ga ya? terlalu bajingan buat saya,negative
masih belum nonton dark season karena ga nemu wifi biznet,neutral
admin biznet merusak list bias,negative
biznet dedicated internet! internet terbaik untuk kantor? via ,neutral
jing indihomo tai biznet kaga ada di kaltim bulan depan gua pake kuota aja lah ajg lebih lancar kudu copot wifi udahlah.,negative
cah indihome biznet penak e ge omah daerah kota,neutral
sempet kesel banget internet biznet slow trus mati idup tapi jadi mikir kok jadi gini banget ya hidup gua tanpa internet kek gabisa gitu,negative
 cm untuk kulon semester ini aku mau daftar wifi di rumah boleh minta review wifi ind home biznet atau jujungnet? sekalian plus minusnya boleh jugaa,neutral
guys ada gak yang masih pake modem wifi? minta saran modem wifi yang ga mahal banget dan paketannya terjangkau pokoknya yang recommend. soalnya semua tiang indihome cbn biznet lebih dari m dari rumahku.,neutral
 jbrfess mau pasang wifi nya biznet hubunginya kemana ya rek?,neutral
pasang biznet area jombang ada ga ya?,neutral
ymmpun provider inet di indonesia gaada yg bener apa alias biznet dlu di kantor pas magang bagus sih wkwk ,negative
bener bener biznet pagi pagi,neutral
kalah ganti biznet,positive
pdg! lah ado first media atau biznet di bkt sanak?,neutral
 jbrfess ada yg rumahnya griya mangli? biznet apa udah bisa di griya mangli?,neutral
menunggu bendera biznet berkibar di kelapa gading,neutral
biznet nyebelin,negative
paket internet wifi rumah termurah dan terbaik indihome firstmedia oxygen biznet workfromhome ,neutral
sampe kapan sih biznet nih musuhan sama twtr,negative
akhirnya masang wifi pilihan jatuh kepada biznet! sblm nya mau first media tp blm nyampe jaringannya di goldenland.,positive
menunggu biznet masuk mbantul lama sekali y,negative
ngebayangin gue punya ps pc gaming high spec full with gaming gear tv monitor wifi nya pake biznet.. anteng banget gue di kamar kali ya? ogah an keluar wkwk. jarang ngeliat matahari kayaknya,neutral
 k bayar internet biznet we jeh susuk susuk e tuku nasi telur entuk akih..,neutral
wifi kosan diganti biznet wohooww!! mantap jiwaa.. bye bye indihome!,positive
gw pake netflix k utk tv oled dg koneksi biznet mbps lancar jaya,positive
biznet menjadi salah satu perusahaan penyedia jasa internet yang banyak digunakan pihaknya blak blakan soal kondisi perekonomian hingga trafik saat pandemi. ,neutral
astaga biznet jangan kau ikuti jejak indihome lemott ini woyy,negative
yaela biznet udh kyk indihome smua aj di internet positif in,negative
wifi rumah trouble yodah kerumah temen coba udah pd banget ngluarin laptop eh sama wifinya trouble juga emang biznet eekk,negative
mending pake three xl axis kalo buat ngegame. klo wifi ak pke biznet mntul,positive
kantor gak masuk wilayah biznet ataupun my republic. akhirnya harus nunggu first media confirm karena gak kuat bayar indihome. hah. apa beliin anak anak paket telepon aja ya ,negative
kirain email masuk ada kerjaan baru ternyata tagihan biznet.,neutral
disini ada yg pake wifi atau kerja di biznet? tf ,neutral
mo langganan pake biznet deh masuk ga ya daerah gue,neutral
first media minggu ini kenapa dari jelek makin tambah jelek ya? gara gabisa pasang biznet ajanih gw masih stuck pake profider lo,negative
indihome gada akhlak anying dah la gue mau ganti ke biznet aja,negative
mau coba pk biznet drumah bapak.. smg gabanyak kendala seperti provider yg kupake drumah sini,neutral
budak! macam mane care berlangganan biznet? kantornye dimane?,neutral
hal paling tergreget hari ini ngurus isolir wifi bareng ibu kost trus nanya pemasangan wifi biznet ke customer service indihome..,neutral
se goa inikah tmpt gua tinggal.. sampe fm myrep biznet tidak menjangkau..,negative
sayang sekali di kotaku desaku belom ada koneksi myrepublic dan biznet,negative
netflix error pas drama jcw ma syj mau tayang. biznet mantul,positive
ketika daerahku hanya terjangkau oleh indihome saja bahkan mnc play dan first mediapun tidak apalagi biznet. pengen pindah rumah aja,negative
naha sih biznet can aya jalurna ka rumah urg? geus muak pake indihome bgst baru bayar loh tgl masa fup nya abis? muka status whatsapp wae buffering indihome tai emang,negative
ket iki aku donlot sampek mbps keatas tumben biznet,positive
ga indosat ga pln ga biznet sama aja kalau di komplain penanganan hanya sebatas disuruh restart sinyal mohon maaf ada gangguan tapi ya tetep aja,negative
seandainya biznet support daerah cianjur,neutral
halo teman it ku. mau tanya nih jadi koneksi di rumah pake biznet mbps cukup lah ya. lalu daily driver aku pake samsung galaxy note . nah masalah yang lagi aku alami kenapa whatsappku sejak tadi pagi ga ada chat masuk sama sekali? posisi wi fi sudah on. kira kira apa?,neutral
demi apa biznet gk bisa dipasang di rumah ,negative
parah dah narogong xlhome belom ada my republic blm ada biznet juga ga ada terjebak sama indigo,negative
biznet ga masuk. stuck with indihome again. terus ternyata ga bisa daftar pake akun yang sama. lol wut.,negative
moo po no profit album hwasa maria limited biznet version amp reguler version for details bisa cek dibawah ya ,neutral
 di nangor wifi yang bagus dan ga mahal bgt apa ya? kalo kaya first media biznet mnc gitu kejangkau gak sih?,neutral
rumah w terkutuk bgt dah biznet lemot telkomsel lemot,negative
dukung belajar di rumah biznet goes to school online jakarta biskom biznet sebagai ,positive
gokar! pilih mana ya antara indihome biznet atau first media kalo di karawang?,neutral
mau ganti wifi ke biznet males bgt sama indihome iyuh masa waktu mendekati batas pembayaran cepet banget sampe mbps per perangkat eh pas habis dibayar lelett bangett iyuh,negative
 biznet dong mas k dapet mbps ,positive
moo tutuppo albumnya hwasa tuh tanggal brp sih guys aku liat kok beda tiap website yg selain biznet ,neutral
min saya kok ga bisa buka laman ya? kalo buka yg lain lancar. iya bener mau liat paket biznet.,neutral
 bosku biznet udah masuk bsd foresta belum?,neutral
haloo biznet kenapa gangguang sih dari tadi pagi ,negative
samperin welah ke biznet besok emosi sama serumah yg ga kek istana aja masih putus putus,negative
kapan biznet masuk sendangadi mlati ,neutral
bagi sekolah yang pernah bekerjasama dan terdaftar dengan biznet murid muridnya bisa ikutan kelas online biznet loh. psst masyarakat juga bisa ikutan. ,positive
biznet bantu kegiatan belajar di rumah lewat online learning ,positive
wifi yang bagus buat daerah suci apa ya? biznet blm bisa katanya,neutral
iya di sini juga lagi galang kekuatan utk masukin biznet.di komplek depan udah ada blm nyambung masuk komplek saya nih,neutral
biznet gio cloud ingin tahu lebih lanjut feedback dari anda. berikan review kepada produk dan layanan kami melalui tautan berikut ini ,neutral
pengen punya rumah di dataran tinggi yang sejuk. lalu berkebun sayur an buah an. tapi yang ada layanan indihome ato biznet biar tetep bisa online wkwkwk,positive
berikut daftar harga paket internet wifi biznet home lengkap terbaru paketinternet wifi biznet biznethome ,neutral
kalau biznet di bogor gimana guys? ada yg pernah pake?,neutral
naak jepara ada yg pake wifi dr mnc play ga? atau biznet mungkin? mo nanya niiw,neutral
hallo min saya mau coba setting modem router bawaan biznet kok ga bisa ya? saya udah masukin ip adress yg ada dibelakang router tapi kok ga masuk . mhn bantuannya,neutral
 biznet belom masuk daerah gue sedih banget hahaha,negative
semoga atau biznet segera ke purwakarta. indihome menjengkelkan,negative
indihome ga guna first media apalagi bangke. coba ada biznet tp ga mungkin masuk perumahan model begini ,negative
hey coba segera masuk daerah gw. yakin deh banyak yang pasang. indihomo muyan songong.,negative
harus diakui wabah virus sars cov mempengaruhi kebiasaan dan perilaku masyarakat. hal ini disadari oleh penyedia jasa internet biznet. ,neutral
biznet goes to school secara online dukung kegiatan belajar dari rumah via ,positive
 halo sore. terima kasih atas ketertarikannya terhadap layanan biznet. bisa di informasikan untuk layanan hunian atau perkantoran dan informasikan alamat lengkap kamu seperti nama jalan nama kota kelurahan kecamatan agar bisa kami lakukan pengecekannya? thanks rzk,neutral
biznet goes to school secara online dukung kegiatan belajar dari rumah ,positive
 terima kasih atas ketertarikannya terhadap layanan biznet. saat ini wilayah tersebut belum tersedia jaringan kami bila berkenan mohon bisa mengisi data inquiry di website kami untuk rekomendasi perluasan. terima kasih rza,neutral
 ee hi selamat pagi. terima kasih atas ketertarikannya terhadap layanan biznet. saat ini wilayah tersebut belum tersedia jaringan kami bila berkenan mohon bisa mengisi data inquiry di website kami untuk rekomendasi perluasan. terima kasih rza,neutral
memasuki era new normal biznet nampaknya belum akan membuka biznet store untuk pelayanan konsumen. namun untuk instalasi tetap bisa dilakukan loh! biznet instalasiinternet ,neutral
biznet goes to school online diharapkan dapat menjangkau siswa lebih banyak lagi ,positive
kata biznet soal bandwidth dan penjualan selama pandemi covid biznet ,neutral
skills hunter! ada kelas online buat tambah ilmu dari biznet bagi sekolah ,positive
korea utara juga punya outdoor wi fi service kayak biznet amp namanya mirae artinya masa depan . ini tampilan mirae dari smartphone arirang . ,neutral
 gb cmn nunggu disambi ngaji halaman surat an nisa. fantastis biznet! ,positive
disini kadang merasa sedih tapi ada untungnya mulu kejebak hujan akhir bulan. paket mati modem lowbat ujan gede neduh di bawah fly over. untung ada free wifii biznet. nuhun ya lord. ,positive
wabah covid memaksa orang bekerja dan belajar dari rumah secara online. fakta menunjukkan ekosistem digital di indonesia ternayat sudah kuat untuk perubahan mendadak itu. ininilah yang membuat biznet yakin akan tercipta gaya hidup baru usai wabah ,positive
selamat hari kartini bagi seluruh wanita indonesia. ayo kita lanjutkan perjuangan luhur ibu kartini dengan terus bekerja dan berkarya demi kemajuan tanah air tercinta. pakebiznet biznetgiocloud harikartini ,positive
nak masang wifi rumah yak labil nak solat istikharah ape. mane topan bilang biznet lebih bagus bise nonton bokep k ,neutral
masih nyaman dengan indihome dan belum ada iktikad untuk murtad ke biznet sudah ada di jepara . sesekali ada trouble dan bikin jengkel itu bisa saya maklumi karena cukup nunggu hari saja. tapi sepanjang berlangganan tidak kecewa. ,positive
biznet perpanjang upgrade bandwidth gratis dan hadirkan program biznet member get member ,positive
gio talk bersama achmad zulkarnain ceo trustmedis akan membahas lebih dalam peran healthcare information system his di tengah kondisi psbb. yuk ikutan online discussion nya di youtube biznet gio cloud! ,neutral
