hari hari biznet kyk gini gimana mau stream bang ,negative
sebenernya bagus biznet. kalau gak gangguan ,neutral
makasih yang udah dateng amp maaf awal agak patah . biznet lagi tomlol nya. bulan lalu k bitrate aman skarang k aja kadang merah kuning ,negative
 gak cuman indihome ternyata xl home sama persis biznet lebih kejam ,negative
pasti pengguna biznet soalnya sama ,neutral
lebih cepat lebih hemat! dapatkan bonus mbps gratis dari biznet home selama juni . ada diskon biaya instalasi pakai kode pakebiznet saat registrasi. klik atau titok ,neutral
ao ga diblokir tuh? emang palingan cuma dikasih routing jelek throttle doang di bbrp operator isp aja aku biznet aman ,neutral
voucher golden lami gepok kyk biasa ambil di biznet pandanaran yah guys ,neutral
ges mau nanya ada yg pake biznet ga? bagus gak w mau ganti wifi anjg ,neutral
nanya sekarang isp di indonesia bisa otomatis force safesearch on ya? atas layar setting safesearch terkoneksi via isp biznet bawah layar yang sama di network amp isp yang sama tapi pakai vpn ,neutral
biznet bangke banget dah sok asik ,negative
guys biznet oke ga sih layanan nya? sharing sharing dong karena pengen ganti perangkat internet di rumah because kecewa banget sama balifiber ,neutral
uda ngga kerja disini tapi internet commercial biznet memang paling cakep sengadalawan. dari segi harga dan kualitas yang delivered mantul betul. beli up to mbps yang didapet segini ,positive
biznet masih bagus tidaa gaiss,neutral
biznet tu wifi nya kenceng gk gusy dan apakah byk trouble,neutral
target market starlink sesungguhnya adalah siapa pun yang berada di pedesaan pelosok negeri tengah laut gurun gunung hutan perumahan yang di areanya cuma terjangkau internet provider monopoli gudang komplain udah di titik gusar karena biznet gak jangkau komplek w ,neutral
google youtube xl myrep biznet pada kompakan down semua gini broo ,negative
biznet berharap hadirnya starlink demi indonesia lebih baik ,neutral
internet lemot pisan. kurang kah mbps ini anjing! biznet kntl,negative
gila kali nelfon cs biznet sampe hampir menit. mostly isinya nunggu hold pengecekan yang super lama. dah buang waktu buang pulsa. tp no option krn kalo complain via socmed dibales berhari kemudian. z capekdeh ,negative
biznet gangguan?,neutral
biznet knp lg cacat terus dr kmrn,negative
biznet makin lama jadi kayak indihome,negative
gini amat mbps biznet,neutral
udh gakiat sm indihome daerahku ga kejangkau biznet kalo my rep buat valo aman ga?,neutral
biznet semenjak nambah fitur fup jadi makin aneh deh i hate how inconsistent my internet is,negative
sedih biznet lemot bgt,negative
gajadi pakai tachyon gaes gara gara biznet make kabel nya mereka jadi masalah ke tachyonnya bukannya tarik kabel baru malah pakai kabel isp lain. agak lain emang. dah lah.,negative
biznet knp lagi ini twitter woilah,negative
tumben amat nih tagihan biznet turun? kek aneh gitu yah naik turun,neutral
biznet knp dh,neutral
biznet gangguan ye,neutral
sinyal biznet ni tiap malem kenapa sih,negative
woy biznet tolong lah gw udah gak verif terus nonton stream masih ngelag ngelag gini,negative
biznet ngelag banget sats skrg,negative
besok biznet bakal maintenance dan hari ini udah gladi resik h,neutral
baru jam segini biznet kek siput anjer,negative
internet starlink diskon murah ketimbang telkomsel hingga biznet? ,neutral
minimal sehari sekali harus mengucapkan biznet kntol,negative
sinyal akuh bansos banget biznet pls la,negative
starlink diskon lebih murah ketimbang telkomsel hingga biznet? ,neutral
layanan internet berbasis satelit starlink mulai hadir di indonesia sejak mei . hal ini menimbulkan reaksi beragam dari provider internet isp di indonesia. salah satunya adalah telkomsel dan biznet. ,neutral
 hai dm kamu sudah mimin respon ya thanks yib,neutral
 hi ka pagi. mohon maaf untuk kendala yang kamu alami ya karena saat ini ada indikasi gangguan area di tempat kamu. kendala ini sedang dalam penanganan lebih lanjut oleh tim biznet mudah mudahan dapat segera selesai untuk perbaikannya. thanks syh,neutral
ini biznet gaada di banjarbaru kah wkwk lumayan biar wifi kantor dan rumah kenceng,neutral
 hai dm kamu sudah mimin respon ya thanks yib,neutral
puki ni biznet rugi gue bayar ,negative
ganti biznet aja gitu? mnc bapuk,neutral
 hai untuk kendala kamu bisa dm minbiz detailnya ya agar minbiz bantu cek thanks yib,neutral
 hi. pagi. akunnya atas nama pu septi . jika minbiz cek koneksi terpantau aktif saat ini minbiz bantu refresh dulu ya koneksinya mohon dicoba lagi dengan restart perangkat modemnya. jika masih ada kendala silakan dm minbiz ya. thanks mhr,neutral
 .hi sudah dicek ya kak. khy,neutral
ih biznet napa sih lemot banget ampun dah,negative
 yap ini pakai neo lite ss . masalahnya kayaknya koneksi antara biznet ghcr karena saya coba push image yang sama ke docker hub lalu di pull cepet. sementara yang di pull dari ghcr ga selesai selesai extremely slow ,negative
 hai dm kamu sudah minbiz respon ya. thanks mhr,neutral
penyedia layanan internet biznet mengatakan kehadiran starlink di indonesia bisa melengkapi layanan internet di wilayah terpencil. ,neutral
biznet hadir di batam dengan bandwidth lebih besar dan harga terjangkau tempotekno,positive
biznet hadirkan kecepatan internet lebih besar dan harga lebih terjangkau biznet batam ,positive
ribet banget lu ampe bulan depan gak bisa pindah biznet aja saya customer service gak jelas. nyesel tiap dikirim survey via email saya kasih rating bagus,negative
 halo silakan dpat dm minbiz perihal kebutuhan kakak terkait layanan biznet. thanks trq,neutral
udah jam internet biznet mati ganggu aktifitas aja nih biznet,negative
 hai dm kamu sudah kami respon ya. tks anw,neutral
 hai semoga dm kamu sudah kami respon ya thanks syh,neutral
numpang promo ya gaes jual voucher games amp paket biznet harga terjangkau ,neutral
biznet hadir di batam dengan bandwidth lebih besar dan harga terjangkau ,positive
biznet hadir di batam dengan bandwidth lebih besar dan harga terjangkau bandwidth harga batam ,positive
wifi di rumah pake biznet atau indihome ya? ,neutral
kenapa ya internet di rumah saya biznet sama indihome di hp ga mau connect ke instagram dan youtube? sedangkan first media bisa.. aneh banget dah,negative
kalau tv kabel dr biznet bagus ga ya ?,neutral
biznet lambat banget. gangguan kah?,negative
 hai kak untuk keluhan kamu dm sudah minbiz respon ya. thanks trq,neutral
biznet the best provider with high speed and high quality service. recommended banget untuk kebutuhan internet rumah,positive
penasaran ini biznet langganan tahunan masih ngaruh ga ya? atau lebih murah ga ya?,neutral
kok bsa biznet gue mati ga ada sinyal? min udh restart tapi tetep ga bisa ,negative
 hai untuk kendala kamu sudah kami respon di dm ya. thanks trq,neutral
biznet paling cakep,positive
waduh biznet kacau nih,negative
 hi kak! untuk kendala yang kamu alami dm sudah minbiz respon ya. thanks mhr,neutral
biznet emang terbaik untuk layanan internet,positive
biznet is still the best internet provider for home in indonesia,positive
biznet bikin kesel banget sumpah,negative
sebenernya kalo lagi bagus biznet itu kenceng banget ga sih ,neutral
biznet lemot kaya siput,negative
 hai dm kamu sudah minbiz respon ya. thanks mhr,neutral
biznet gangguan lagi kan anjrit ,negative
kenapa lagi sih biznet,negative
gimana kenceng ga itu biznet,neutral
biznet mantap kalau lagi ga gangguan,neutral
biznet ini penyedia internet terbagus sih,positive
 hi kak! dm kamu sudah minbiz respon ya. thanks mhr,neutral
kayaknya biznet oke juga ya buat internet rumah,neutral
 hi ka. dm kamu sudah minbiz respon ya. thanks mhr,neutral
biznet internetnya kencang banget buat main game,positive
 hai kak. dm kamu sudah minbiz respon ya. thanks yib,neutral
maaf ya guys biznet lagi gangguan hari ini,neutral
gimana sih biznet nih,neutral
 hi kak! untuk kendala yang kamu alami dm sudah minbiz respon ya. thanks mhr,neutral
internet biznet gangguan mulu akhir akhir ini,negative
biznet mau tambah layanan tv kabel nih. semoga aja lancar ya,neutral
 hi kak! untuk kendala yang kamu alami dm sudah minbiz respon ya. thanks mhr,neutral
biznet internetnya cepet banget buat streaming,positive
sinyal biznet makin jelek aja sekarang,negative
biznet customer service responnya lama banget,negative
kenapa biznet dari tadi malem lemot banget,negative
biznet sering down akhir akhir ini,negative
 hi kak! untuk kendala yang kamu alami dm sudah minbiz respon ya. thanks mhr,neutral
internet rumah gue pake biznet dan kenceng banget,positive
 hi kak! dm kamu sudah minbiz respon ya. thanks mhr,neutral
biznet internetnya suka tiba tiba lambat,negative
sinyal biznet kenapa tiba tiba hilang,negative
biznet tuh paling sering gangguan sih,negative
gila sih biznet gangguan lagi hari ini,negative
biznet kadang kadang oke kadang kadang enggak,neutral
biznet kenceng banget buat main game online,positive
kenapa sih biznet sering banget gangguan,negative
biznet langganan internet rumah paling oke,positive
biznet suka tiba tiba lemot ga jelas,negative
kenapa internet biznet jelek banget sih,negative
biznet tuh bener bener deh sering gangguan,negative
lebih dari ribu data pengguna layanan biznet telah dibocorkan di dark web. data yg bocor nama email nik npwp nomor hp alamat dll. dibocorkan oleh threat actor yg mengaku sebagai karyawan biznet yg tak setuju dengan kebijakan fup yg baru saja diterapkan oleh biznet.,negative
gg biznet inet gue mati total kemaren diganti modem baru sama yang dual band g gratis,positive
 tolong dong tambahkan biznet sebagai upstream,neutral
buruan ngentod biznet tolol kebiasaan kalo pas live stream suka ngelag babi,negative
keren bgt bro biznet lapor dibales sebulan ,negative
biznet festival hadir di malang! ada band modern dance cosplay dan esports gaming plus penampilan keren dari gigi dan dj hannah x. sabtu april lapangan rampal malang gratis! biznetfestival malang . registrasi sekarang di ,positive
semuanya tolong jangan pakai biznet gue baru perpanjang biznet tahun. bayaran udah masuk tapi internet ga bisa smp bulan gue telp tiap malem chat setiap hari katanya x jam tp apa? masih ga bs!! ,negative
yg bilang fup biznet ngeselin ini kenyataan penggunaan wifi di rumah bokap gw yg pada seneng bukua youtube ,negative
 batalyon a pelopor brimob kaltim sukses amankan festival biznet dan andran and the backbone di balikpapan ,positive
ini enak langganan juga dari sma tapi begitu kenal sama sari dele imam bonjol sebelah kantor polisi amp bubur ayam elisabet koe jadi berpaling huhu. mana bapaknya super ramah plastik masih k coklat maupun ori. kadang payung biznet kadang pelangi ,neutral
kalo abis bayar nge gas si biznet ini ,positive
biznet festival. sabtu april lapangan rampal malang gratis! biznetfestival malang . registrasi sekarang di ,positive
 moon maap pak tadi restart meteran listrik. ini beberapa isps menarik buat digunakan. yang raspi pakai biznet ,neutral
biznet emang gini ya? server singaporenya aja ngedown ,negative
halo saya bulan lalu sudah bayar tagihan biznet untuk promo namun promo nya belum masuk sudah pernah komplain tapi tidak digubris sama sekali sudah sebulan lebih ini bagaimana ya prosesnya? ,negative
 hari ga konek mulu.. wa teknisi nya gangguan masal. provider sebelah. aman aja.. dah mulai sering ga konek mulu nih biznet semenjak tiba harga naik. ngemail pertanyaan kenaikan ga di jawab.. parah.. ,negative
terimakasih wifi biznet maha dahsyat rumah musang manga,positive
 sebagai bagian upaya strategis untuk memperkuat ekosistem digital di indonesia portal berita inilahcom mengumumkan kerja sama dengan biznet perusahaan infrastruktur digital terintegrasi yang telah berpengalaman lebih dari dua dekade dalam ,positive
biznet gangguan ne ton?,negative
tiap hari biznet error ,negative
biznet festival gebrak balikpapan ajak milenial unjuk bakat ,positive
bersama biznet persembahkan andra and the backbone ajak anak muda kreatif ,positive
andra and the backbone ajak penonton biznet festival balikpapan bernostalgia ke tahun an tribun kaltim ,positive
biznet festival balikpapan beri wadah generasi muda unjuk kreativitas di lapangan spn brimob tribun kaltim ,positive
ngape biznet tiap jam an tuh inet nya down babi kan aku tu pengen main.,negative
yaallah biznet napa jelek bgt sih,negative
biznet lu mnyt bgt tai,negative
day di kacangin biznet tolong cek dm min ,negative
hadeuh mau pindah dari my republic gegara mati melulu eh biznet ternyata ada fup. masa menyerah ke indihome. tidak mau ,negative
budak! mending indihome atau biznet? atau ad yang pake iconnet? review jujurnya dong,neutral
wah biznet kesamber kah,negative
biznet ada gangguan apasih ,negative
biznet festival di kota malang digelar seru ada gigi dan dj hannah x ,positive
teknisi biznet ini naik atap rumah orang ga ada izin ga ada permisi dulu eh,negative
biznet ping ku knp kek saham bitcoin gini ajig,negative
indihome tiap jam gangguan terus lama lama ganti dah ke biznet atau myrepublic,neutral
aneh gua sama biznet speed konsisten di mbps tapi nonton youtube buffering even diset ke p kebawah tapi giliran gua pasang warp lah dia lancar ampe p juga. ini emang penyakit biznet apa gimana dah ,negative
biznet nih lama bner deh,negative
ini biznet knp,negative
pake biznet tiap sebulan sekali wifinya selalu ga bisa digunakan gara kabel di putus sama kompetitor,negative
ini biznet lg down apa gmn sih? bahkan customer carenya gabisa dihubungin berkali kali?,negative
rumah nyaman tapi gak di cover biznet cuuk,negative
biznet tiap tengah malem ni selalu ded jaringannya brgsk,negative
biznet gua udah niat mo kerja lu lemot tai,negative
buset emang sii lu satu suara ama customer yang protes soal kebijakan fup biznet cuman klo mengancam ngeleaks data pribadi mereka juga agak kocak sii,negative
monyet biznet gangguan muluu!,negative
di rumah indohoe hampir k lupa. kl di tempat kaka biznet k kurang dikit,neutral
tolong biznet diperiksa servernya anjay aku mau main,negative
selain biznet aku gak percaya sm kecepatan wifi lain titik kalo buat war mending pake paket data,neutral
biznet ambil paket internet mahal error mulu heran,negative
biznet ini apa dah suka banget dns nya ngacak,negative
keknya gue harus ganti router deh ini gak ngangkat mbps biznet bjir wkwk,neutral
tiap jam malem sampe jam malem emang pasti ping gede ya ini biznet bandung ,negative
biznet sby bapuk ya twitteran aja loadingnya lama,negative
anjing mau nyoba tes tapi koneksi gak wifi biznet gak indosat sama sama bangsat,negative
wifi biznet di ruma berubah nama ? dan setela utak atik modem config ternyata hanya perlu diganti vlan nya ,neutral
biznet tiap bulan mesti losmerah kenapa banget sih?,negative
kesel aku biznet raiso dinggo sejak jumat,negative
biznet klo hujan gede gini emng sinyalnya suka ilang kah?,negative
 wkwkwk katak biznet,neutral
biznet kamu kenapa sih,negative
biznet monyet udah hari wifi mati ga di perbaikin,negative
aduh. biznet kok lemot banget ya ada yang sama gak?,negative
ini biznet kenapa dah buat nonton tiktok leletnya minta ampun,negative
biznet kenapa lagi ini aa,negative
woy cara login biznet liat tagihan ini gimana gaonok aplikasi ta web e ta?,negative
ganti biznet lah bulan depan indihome cem pepek,negative
omaga today is the day akan ku lawan calo sialan ini dengan biznet lelet ku,negative
gue beneran ganti biznet anjir,negative
yaallah biznet kenapa lu mesti gangguan sekarang sih yaallahh tuhaann,negative
biznet knpp muter trs si,negative
biznet parah amat ini beberapa hari ini,negative
duh lah biznet kuntul,negative
di grup rt mulai ada yang ngeluh biznet gangguan dan gak secepet waktu awal pasang dulu waktu awal biznet masuk ke komplek banyak banget yang mengelu elukan ngehina hina firstmedia indihome bahkan gak dibahas samsek wkwk padahal mah isp di kita ya gitu semua kurang ok,negative
biznet jelek banget dah hari ini,negative
woi biznet jelek banget lu,negative
biznet gangguan kah? ,negative
ini yang gangguan biznet apa netflix sih?,negative
telkomsel sinyal kenapa lagi sih ini cjbabasjaba mana biznet kantor juga bapuk banget,negative
mendingan mana biznet or iconnet? soalnya indihome udh mulai ngelantur,neutral
biznet kenapa yah? ,negative
ada rrq sama onic di biznet fest di taman saparua bandung apakah aku harus datang? kepo ga sih pengen liat langsung,neutral
min info pemasangan biznet area slipi palmerah jakarta barat dong aku sudah dm yahh thank youu,neutral
ini biznet kenapa sih belom bener,negative
iki koyo nek aku karo cah discord sambat r coplok opo x e ngejam. neknya pas nyalahke jaringan biznet. nahh ngono kae. wkwkwkw,negative
biznet lagi kenapa ya z,negative
trims biznet dan vision yang sehat malem ini jadi gw gaperlu nobar biar langsung tidur,neutral
kalian ada yang pake wifi biznet gak? spill dong budget dan kelebihan kekurangan nyaa,neutral
kebiasaan bet biznet jam segini suka rada ,negative
meskipun gue tetep love hate relationship sm myrep tp masih mending ga se sering itu maintanance nya kalo sm firstmedia hate banget allahuakbar dari dulu gue gatau apa yg merasuki bokap nyokap gue balik ke provider ini lagi pdhl udh gue blg jgn biznet pls masuk ke area gue,negative
 ahh pantesan biznet wkwkwk,negative
ini ga tsel ga biznet kok burik bgt sinyalnya,negative
wih jatah tb kuota biznet gue baru kepake gb wkwkwkwk,neutral
internya biznet kayak bangsadd deh udah berapa hari ini lemot,negative
 biznet belum masuk si kampret indihome juga belum bangkrut,negative
biznet koneksi internasionalnya lagi dongo anj,negative
bang kenapa sih kok my biznet web gabisa dibuka terus sering bgt errornya loh mau cek promo jadi susah mana skrg biznet nambah mahal banget,negative
 seratus duaratusan di biznet kalo hoki kadang nyentuh single digit megabps,negative
biznet rumah orang tua saya sebulanan ini rto melulu,negative
biznet gangguan kah?? ,negative
biznet kalau ada gangguan ngadu lewat tlp ngabis ngabisin pulsa lama beeng diangkatnya lewat dm di x dibales sebulan kemudian lewat chatt di web responsenya lama beeng,negative
ajg biznet hari gangguan mana telkomsel bapuk bgt ini bgst,negative
jir baru tau di pacitan udh ada biznet hm,neutral
ini biznet gw doang apa gmn si tolong,negative
mamang biznet ini kenapa si keknya udah ada semingguan koneksi tuh aneh bat. kek ngadet gajelas. ,negative
gaje amat biznet! kenapa ga ada sinyal ini,negative
cukk wifi mnc bapuk benerr sinyal cuma kocak biznet kapan sampe tempat gua dah ini,negative
 sekian ada sih idcloudhost biznet gio nevacloud,neutral
ini biznet dari bulan kemaren mati mulu kenapa ya? ,negative
ada yg pernah pakai my republic atau first media? mending mana? biznet dah mulai ga jelas speednya,negative
perasaan langganan biznet sma indihome sama gedek nya gangguan mulu ya klean!,negative
ini biznet bener njir,negative
sue bgt lah biznet emg,negative
biznet error di area buaran bsd ini.sampe kapan.? please donk biznet.buruan beresin.parah deh biznet.,negative
meriah! biznet festival di kota malang ,positive
 biznet data leak mas data pribadi saya termasuk yang kena dampak,negative
biznet mahal doang telat dikit denda tp gini hari gaada cs cepet ,negative
halo gimana ya cara cek masa aktif skrg skrg ini? my biznet pun sepertinya tidak bisa diakses hingga saat ini,negative
tumben deh wifi biznet jaringannya jelek,negative
min mohon respon keluhan gangguan biznet di rumah sayaa cek dm min,neutral
open yaa netf kena household yang jaringan mnc indihome biznet myrepublic jadi tolong baca pinned aku ya,neutral
biznet pamulang kpn nyalah lagi internet habis kabel di putus sama pu ? ,negative
ini aku mau daftar buat masang wifi biznet kok websitenya error mulu yah ,negative
indihome k keknya lupa sih. niatnya mau pasang biznet first media tapi tuh belom ada dikota ku,neutral
biznet dukung pemerintah tumpas rt rw net ilegal termasuk sanksi bagi isp ,positive
biznet ada masalah apa di daerah graha raya sinyal dan kualitas internet lemot dan timbul tenggelam? cc ,negative
seperti biasa biznet metronet nyebelin not recommended,negative
petugas biznet mata lu ada sakit nya kata gue mah! masa berlalu sampe masih berlaku tapi gegara lu salah liat tahun jadi tahun internet diputus. gembel,negative
ada hari lain buat error si biznet milih pas gue seru serunya nonton,negative
info lapor gangguan biznet malang kemana ya ? ,neutral
download crackan matlab gagal mulu lama kantor biznet gw lempar meja,negative
server bank aja harus di indonesia apalagi server yg pegang data jutaan pemilih. padahal alibaba amazon atau biznet ada di indonesia semua pakai ip indo juga,neutral
yang jual netflix mingguan bisa dipake dgn wifi biznet dong tolong bgt capek udah dua kali ganti tmpt beli tetep ga bisa login zonauang netflix,positive
demi apapun susah bgt hubungin cs biznet skrg masa nunggu seminggu baru di respon sm admin x ,negative
cs nya biznet nih kerjaannya apa sih,negative
guys gua lagi mau ganti provider wifi dari ind ada saran ga ya gua lg bingung bagusan biznet atau myrepublic atau mungkin ada rekomen lain? trims,neutral
biznet nih kenapa sih bjir,negative
jancok afk cok aku polean asu ancen biznet,negative
adakah warga bogor barat dan sekitarx.. ? apakah ada yg pake biznet??,neutral
sumpah dah biznet sampah bener gw ganti myrep ajalah.,negative
biznet seharian eror kntoll,negative
wah vier sudah ready lagi dengan satset biznet kau sia. astaghfirullah. vie gak boleh ngomong kotor. vier sudah bisa satset lagi yah akak sekalian. yang mau jajan boleh yuk lari kemari. vnmf,positive
min udah di dm kaga dibales.. jaringan kenapa dah.. biznet,negative
min biznet jogja lagi error ya? soalnya speed kepotong banyak dan sering down juga pagi ini. mau login mybiznet juga ga bisa .,negative
halo saya mau coba login ke website biznet untuk cek tagihan kok akun saya tidak terdaftar ya ? bisa tolong dibantu,negative
halo disney star kenapa tidak bisa di akses ya lewat biznet. katanya internet nya ngeblock pake vpn. sementara saya coba pakai telkomsel hp aman saja.,negative
biznet knp aftersalesnya kek jelek bgt si cok apaan gaada membantu sama sekali dteng cek semenit pulang lah p mksd anjing ,negative
jam pagi bela in telp biznet karena gangguan down udah masuk hari ke . ternyata belum ada info gangguannya ada dmn lah ngapain aja coba ini kalau nunggu terang cs biznet ga bakal bisa ditelp. japri dm di twitter jg ga ada yg respon!,negative
demi allah wifi kos biznet dari pagi lemot dan sering putus koneksi. gua jadi ga bisa ngapa ngapain progres ta juga ga bisa nugas yang lain juga. kalo sampe sore ini ga bener bener dan kalo ta atau tugas gua lainnya bermasalah gua akan tuntut lu biznet di akhirat!,negative
biznet ini jarang ada gangguan tapi sekalinya ada gangguan customer service nya jelek banget ya. kebalikannya indiehome. sering ada gangguan tapi customer servicenya bagus.,negative
halo internet saya mati. bisa tolong dicek untuk daerah bandung. cek web ga ada notifikasi apapun. saya coba create tiket di tetapi ketika submit lama sekali cuma ada logo biznet puter udah beberapa menit. mohon diperbaiki. terima kasih.,positive
terimakasih om biznet ,positive
kabar gembira dari guys mulai januari tarif biznet naik ada fup ,negative
mulai januari biznet pakai kuota gaes kalau udah lewat kuota bandwith akan dibatasi. silverlining harga paket jadinya bakal starts from rb lebih terjangkau ,neutral
damn biznet dah mulai berulah lg.. ganti provider apa ya taun depan ,negative
privilej lokasi dalam kehidupan . tinggal di lokasi dengan air bersih . tinggal di lokasi yang tidak macet . tinggal di lokasi dengan coverage biznet agar bisa terhindar dari servis first media yang saya mohon ampun,neutral
biznet klo lagi baik ya baik banget ,positive
btw udah bisa lagi ges gg sekali ini teknisi biznet dari proses pengaduan sampe resolve kilat bgt tanpa chatbot chatbotan pun ,positive
biznet dr kmaren kenapa sih lemot bgt mau stream gabisa yaampun ,negative
pagi hari diawal bocah tantrum dan internet los lagi kesekian kalinya. nice bgt biznet. ,negative
speed wifi segini aman ngga sih buat war tiket?? soalnya biznet kadang sering stress gak jelas ,negative
 eh si biznet kayaknya juga udah buat nih versi wpnya ,neutral
lucu juga ini biznet. dulu pake biznet karena unlimited dan rumah baru tercover dengan kecepatannya yang bagus. eh skrg malah pake sistem kuota auto copot sih ini ,negative
ini mksdnya biznet udah gak unlimited lagi gtu? ,negative
gua pengen berhenti make biznet tp gua belum tahun makenya tp bingung jg nanti abis masa tahun make nih mau ganti kmn. semoga ajah tahun kedepan nanti lebih baik lg dah males bgt suka ampas tiba hadeh. ,negative
harga tahunan biznet vs vs yang sudah sempat turun berangsur naik kembali ,neutral
gue baru aja langganan biznet? apa apaan ini,negative
kemaren ada tiang odp baru dari myrepublic andai ini biznet saya putus ganti ke tanpa pikir panjang. heran juga myrep tau sampe sini sedangkan biznet kurang greget nambah jangkauan ,neutral
kabar gembira sikut lu meledak. udah bertaon taon pake biznet karena unlimited walaupun akhir akhir ini harga naek makin lemot ga ngasih kompensasi apa apa tiap maintenance sampe berhari hari sekarang malah dikuotain najis. yang bener lah jir ,negative
wah.. biznet pake kuota sekarang. hm. saingan sama indithome.. ,negative
di plaza telkom permintaan pemberhentian dgn beragam prosedur dan kelengkapan dokumen eh malah di x hanya minta isi data. lu percaya ga? gw kagak indihome biznet cbn firtsmedia mncplay ,neutral
biznet gangguan ya?,negative
biznet kambuh lagi penyakit errornya,negative
dulu ngekos di bandung yg super murmer dan internetnya biznet. nikmat manakah yg kamu dustakan,positive
biznet aku kenapa ya padahal maleman mau stream ,negative
