oxygen yg mbps langganan setaun lebih mahal dr biznet hmm,neutral
biznet lagi gangguan kah?,negative
kalo udah dibenerin gini biznet emang terbaik luwancar byanter,positive
twitku gak ditanggepi biznet malah jadi tempat keluh kesah pelanggan biznet,negative
pada pindah biznet aja sie,neutral
biznet jogja ngapa nih,negative
waduhh biznet error lg,negative
to do hari ini masang biznet berhentiin indihome balikin modem ganti temper glass ipad ke asoris ganti kampas rem ke bengkel cuci motor yang gagal cuma yaitu balikin modem indihome ternyata harus di plaza telkom yg di pasar rebo ,neutral
packet lossnya biznet ga separah sebelah sih tapi tetep aja itu bikin gabisa main game,negative
koneksi biznet ganti pakai f.o malah sering gangguan,negative
harus beralih ke biznet ini mah,positive
 x lebih padat tapi disini cuma ada pengguna tiap penduduk di thailand bisa menjangkau pengguna tiap penduduk. artinya thailand x lipat lebih efisien dibanding jawa dalam menyelenggarakan internet broadband yg pake kabel kayak indigo biznet dkk ,neutral
cah kalian sing pakai wifi biznet apakah ada gangguan? kok punyaku agak lemot yaa,negative
biznet jgn eror dlu anjeng,negative
oh biznet kenapa kamu ,negative
biznet sama indihome kenapa bareng gini gangguannya?,negative
knp sih biznet streamjng di tv lancar bgt di laptop buffering trs drtd,negative
biznet plis aku pengen mainan mas disconnect terus. jarang nyante ini loh.,negative
taun depan ganti indihome. ini udah keterlaluan. mending biznet aja,positive
 di hp bisa tapi kalo ke laptop tetringin jadi gabisa wifi biznet bisa,neutral
ga ngiro bakal teko kene biznet dalam waktu singkat,neutral
pulang ke rumah dan ga bisa internetan biznet asyu,negative
nih biznet ke genshin kenapa dah?!! pingnya parah bgt padahal kalau yg lain internetnya normal ,negative
biznet mantap langganan error mulu ,negative
biznet bangsat gue udah x nulis update di blog jadi ilang karena internet gangguan dari tadi,negative
euy minta testi dong yg pake biznet di cimahi terutama cigugur atau sekitarnya yg deket sering gangguan atau lancar aja ya? nuhun sateuacanna,neutral
biznet tolong kerjasamanya,neutral
biznet capai . homepass di palembang ,positive
lagi mau pasang wifi nih bagusan mana ya firstmedia atau biznet? atau ada saran lain,neutral
biznet is the best internet service provider in indonesia ,positive
klo daku berhasil terimakasih biznet klo gk babay biznet,neutral
astaga biznet sialan error dari pagi belom kelar,negative
sepertinya internet biznet rumah gw lagi gangguan juga..gangguan nasional kah?,negative
biznet langsung down dimalang juga? apa gimana?,negative
ya allah biznet kenapa sih yaudah aku pasrah pake paket data,negative
pengalaman pake internetnya biznet di bali.. banget banget banget tau dong ya artinya ,negative
ini kenapa biznet gangguan lagi dah,negative
biznet lo kenapa anjir,negative
makasih sebulan internet gue gangguan terus,negative
ini internet biznet lemot atau laptop gw ya. ko pake wifi biznet lemot bener.,negative
beli wifi biznet ngelag,negative
kenapa sih biznet?,negative
biznet lagi gangguan ya?,negative
gw marah sm customer service biznet karena baru gw telpon besok baru dateng padahal urgent ,negative
biznet gangguan,negative
sepertinya ini pertanda harus ganti ke biznet ni hm,positive
biznet gangguan lagi lah elah,negative
biznet down dong,negative
min biznet knp? internet mati dr jam an skg belum nyala,negative
menyedihkan ya biznet kayaknya kita gajodoh. padahal kemarin masih manis bener ,negative
biznet goblok layanannya anjing emang,negative
koneksi biznet di cibubur hari ini drop sejak sore,negative
biznet is the best internet service provider in indonesia ,positive
biznet internet provider terbaik,positive
lagi enak enak nonton drama eh tiba tiba biznet error..seuprit nya deh bikin kesel,negative
biznet lumayan lah ya ,positive
akhirnya pkek biznet ,positive
gw termasuk yg pindah dr indihome..udah pake dr jaman sma kuliah masi speedy..skrg pindah ke biznet dpt tawaran mbps cm rban..promo bayar bln free bln..total setaun cm . jt ud include modem beli bkn sewa n free instalasi..total dibawah rb ud dpt mbps ,positive
router g nih sebenernya apaan sih? baru pasang biznet setelah putus dari myrep. alhamdulillah masih ada pilihan lain selain indihomey ,positive
halo warga malang! biznet kini hadir lebih banyak di area anda. nikmati harga paket terbaru untuk rumahan hanya rb bulan sudah dapat menikmati internet mbps unlimited dengan upload amp download simetris dari biznet. hubungi titok di ,positive
biznet lu knpe si dah dua hari nihgh masih gangguan padahal estimasi jam ,negative
gt! disini ada yg pake biznet?aku mau daftar baru paket yg home internet c k bulan tapi pas mau pembayaran harga paketnya jadi k itu maksudnya gimana ya? ,neutral
andalkan prosesor amd epyc biznet gio hadirkan dua layanan cloud ,neutral
biznet mbps promo bulan dapet bulan only costs . . which means . bulan udah dapet free router ,positive
makin kesini makin busuk anjing biznet tolol ,negative
lucu pak vp kayaknya nyindir biznet ,neutral
pelanggan biznet pasti bakalan nungguin orang telkom botakin kepala. ,neutral
gerr abiss tinggal biznet nih semoga ada diskon tahunan lagi ,positive
halo gais mintol isi kuesioner ya kriterianya . pengguna indihome dengan minimal kecepatan mb . pengguna first media dengan minimal kecepatan mb . pengguna biznet dengan minimal kecepatan mb terimakasih banyak ujry a ,neutral
sinergi biznet dan pemkab jembrana ringankan beban para korban banjir baliportalnews bencanaalam biznet jembrana korbanbanjir ,positive
masutnya pindah biznet ka,neutral
biznet di blitar dari minggu sampe skrg gajelas bgt ga ngangkat blas telkomsel ni tumben nya jg suka degrading kualitasnya indosat dari dulu smp skrg pun ga pernah bisa diandelin apalagi cuaca lg jelek gini,negative
biznet adalah provider internet terbaik di kelasnya,positive
byk yg rekoemn biznet sebagus itu kah?,neutral
udah monopoli pasar malah playing victim ngotak lah njenk. untung uda gnti biznet kehidupan ku lebih membaik,positive
ampun dah . biznet semingguan ini down mulu sampe x beli kuota,negative
nah biznet gue udah noted ini mantep ya?,positive
biznet budget mulai brp bli? bisikin donk..,neutral
 cm halo gais boleh minta tolong isi kuesionerku? cuman pertanyaan kok. kriteria user indihome min mb first media min mb biznet min mb. sankyu,neutral
beruntung di tempat ane ada biznet,positive
baru pasang biznet hari ini udah x problem dan munculnya sewaktu hujan. kok malah gini biznet kecewa,negative
kalo mau pasang biznet itu ada biaya instalasi ya gak free? wkwkw pengen beralih tapi liat harga instalasinya lumayan juga kayaknya..,neutral
kopag dimana yg tempatnya pake biznet?,neutral
jadi inget ayah. aku dari lama udah gamau lagi kayak gini ke ayah. karena aku sadar tanpa diminta pun pasti aku dikasih lebih. kemarin bayar bulanan biznet habis sekitar k an. aku pun bilang ke ayah yah aku gausah dikasih sangu deh tinggal skripsian juga gapapa kok,neutral
aku cinta biznet,positive
mantap biznet doang yg stabil yahh? soalnya waktunya bayar jadi di stabil in coba next week. pasti ikut an down wkwkw,neutral
biznet ke anu tlpnan gak bisa space bisa kan anuu ya,neutral
wkwkw biznet kena komplen yg salah servernya aws,neutral
dah lah ganti biznet aja klo sampe besok masih janji palsu,negative
biznet kok agak ngelag y,neutral
biznet kenapa ya?,neutral
ini biznet knp mati internetnya anjing,negative
ini karena gak ada pilihan lain aja. ayolah biznet kapan sampe tigaraksa.,neutral
ada yg pake biznet ga? cara buat akun nya gimana dah?,neutral
 kle biznet kalian gangguan kah?,neutral
ngang ngong ngang ngong komputer bodol biznet bapuk telkomsel bapuk matursuwun,negative
internet mati ngadu terus teknisi dateng dan bilang besok balik lagi terus sampe skrng gabalik lagi dan internet udah mati hari giliran telat bayar langsung mati tp kerja gini gimana ni ?? biznet,negative
biznet downn meneeh. smg,neutral
perasaan rumah di tengah kota tapi biznet myrep transvision kagak cover area,neutral
biznet bagus gak sih temen ada yg pakai ga? trus perbulannya brp ya?,neutral
biznet knp sihh gaboleh bgt org nyantai,neutral
wifi biznet emang lagi trobel kah cah?,neutral
biznet knp y,neutral
biznet bisa ga sekali aja ga kek kntol,negative
biznet lu kenapa sih.,neutral
biznet perbaikan sistem jgn lama plis sy mau netplik,neutral
ampas bgt biznet,negative
 bulan lagi setaun masang indihome bar iku tak cabut ganti biznet lah ben mengurangi misuh misuh ,positive
apa gue pindah ke biznet aja ya? saran dong yang pake biznet tobat dah sama rumah indi,neutral
 ngantri komplain biznet?,neutral
biznet kok lg lemot si,neutral
daerah rumahku dulu cuma bisa indihome terus bulan lalu seberang jalan buka kantor biznet. cek tarifnya kok lebih murah kepikiran mau pindah ke biznet deh wkwk indihome udah lemot mahal lagi,positive
ini bener gaksi biznet mbps idr an sedangkan dirange harga segitu indihome cuma dapet mbps,neutral
biznet sama dicord kemusuhan apa gimana? ada masalah apa? connecting terus kerjaannya dah,neutral
survei apjii menemukan enam operator fixed broadband yang paling banyak digunakan di indonesia mereka adalah indihome first media mnc vision iconnect biznet dan oxygen. ,neutral
baru sadar starbak botas hotspotnya ganti ke biznet wkwkwk,neutral
orang biznet dateng ada orang gue bikinin teh kan buat orang eh gak taunya ada yaudah gue bikinin satu lagi sambil berdoa semoga ga nambah soalnya gue cuma punya gelas ya gimana ya anak kosan punya gelas banyak buat apa ini juga punya karna sumbangsih fiky wkwk,neutral
 askrl ada yang tau cara panggil teknisi biznet gimana?,neutral
mau pasang biznet mending yang beli atau sewa ya ?,neutral
ini kalo nggak biznet ya mungkin xl home.,neutral
biznet jangan kek indihome lah kontol,negative
mohon maaf temen temen setelah kejadian collabs kemarin aku putuskan untuk menolak semua ajakan collabs yang diadakan antara jam wib karena biznet ngambek terus di jam jam tersebut,neutral
parah banget biznet dari kemarin malem bermasalah mulu anjing banget bangsat,negative
 bener biznet di skrg kecepatan speedtest amp streaming sangat memuaskan,positive
kenapa yah biznet sering dc ya? krna pindah modem kah?,neutral
kenapa router biznet w ga bisa connect ke internet pdhl gaada masalah sama providernya??,neutral
biznet di rumah matik mulu,negative
abis nyoba semua provider wifi dari indihome iconnet myrepublic akhirnya balik lagi ke biznet smoga lancar,positive
izin teman min tanya harga pemasangan internet biznet brp ya?,neutral
nah terus kenapa biznet jelek?,neutral
akhirnya biznet nyala jg,positive
paket tertinggi biznet brp ya temen ?,neutral
nyari apartemen yang sudah tersedia pasang biznet ,neutral
akunya kzl mau pindah ke biznet tapi keitung mahal buat kantong mahasiswa wkwkwk,neutral
biznet oh biznet,neutral
sekarang set up wordpress nggak perlu ribet kan udah ada neo wordpress. harganya super terjangkau mulai dari rp . bulan langsung siap pakai dalam menit cobain neo wordpress sekarang juga dan langsung registrasi di ,positive
saatnya beralih ke biznet,neutral
salah satu good decision in so far adalah stop langganan fm dan pindah ke biznet semoga stabil terus ya jangan kayak your ancestor,positive
biznet lagi kenapa si,neutral
sampai detik ini selalu punya perasaan syukur yang amat khidmat pake biznet dan terus taitai in indianahumz,positive
kacau bgt biznet abis ujan hadeh,negative
mau beli voucher wifi id di app toped trus katanya cuma bisa beli diwebsite. beli di website diminta verifikasi otp habis submit otp malah dialihin lagi ke mobile app. ujian pagi hari gara biznet tewas,negative
biznet gangguan mlu dah kampret kampret,negative
waktu indonesia bagian biznet down,neutral
kesel banget lagi mood genshin malah biznet mengontol,negative
semoga biznet gak begini ya ,neutral
 betul. memang biznet masih paling bagus haha,positive
biznet gak mau buka jaringan di pamulang apa,neutral
biznet asu lg meeting mati,negative
mending pake biznet aja kali ya,neutral
til proyek g bisa mutusin kabel dijalan tanpa pemberitahuan ke provider. rip my biznet connection.,neutral
biznet lg knp sih,neutral
biznet ini klo gangguan berjam gini bnr murka argh. aing mau live mau nyari duit.,negative
please lah biznet ga usah bikin hari gw makin jelek,negative
rajin bgt ya gangguan ini biznet belakangan ini. ni lama twitter gw jd akun sambat doang. arggjhhgg,negative
disimpam karena uda setaun lebih pake indihum dan bbrp bulan lalu biznet masuk daerah sini,neutral
mungkin pacar kamu pake biznet,neutral
update kosan ganti wifi biznet kita liat seberapa handal provider satu ini. semoga gak kliru kabeh,neutral
biznet bisa nambah coverage area ke rumah gue ga plis,neutral
biznet masuk dong ke kampung gww ini kalau begini terus pas jam kerja gw gmn dongg hadehh,neutral
ini biznet sm xl kenapasi,neutral
biznet home gangguan ya. tumben banget lelet.,neutral
biznet darling mau sampe kapan kamu pundung terus tiap malem gini? jem malem pasti aja gini ,negative
cc ini sayang. kebetulan mo pindah ke biznet apa mnc atau apapun wkwk,neutral
lagi ada kerjaan biznet malah down hadeuh badut,negative
biznet kenapa lagi dah? sua,neutral
 biznet masih aman your isp?,neutral
dear biznet kpn u mau masuk daerah rumahku?,neutral
biznet hari ini kenapa yak?,neutral
cuma gara biznet ga masuk ke wilayah gw makanya gw masih pake indihome. yg beginian kompensasinya gratis indihome setahun harusnya,negative
 askrl bagusan myrep atau biznet ya? akhir ini myrep putus mulu soalnya,neutral
ini biznet emg lagi error apa begimana dah,neutral
emang susah banget mau putus dari indihome aku mau pindah biznet plis,neutral
ini biznet knpa ajg ,neutral
biznet lg trouble apa ya ga jalan,neutral
 bitsnet siapanya biznet mas?,neutral
masi misuh misuh perkara biznet masa udh mau memasuki x jam woy,negative
biznet itu beneran kenceng kah? apa gimmick doang,neutral
satu setengah hari woi huha alhamdulillah jam segini dpt kabar udh bener biznet udahan y jgn macem lg,positive
agak gedek aja ini ama biznet udh hari laporan kalo jaringan down tpi di blsnya di sistem kami normal saja pak malah nyalahin mainboard gue,negative
biznet jan ngadat mulu dong. mau kerja ni gue,negative
knp biznet gk ad di shopee si anying. gbs pke spaylater dah gua,neutral
biznet gangguan tsel lemot. udah gangguan aja semuanya biar aku ga main hp mulu,neutral
akhirnya ak nyerah ges.. tethering pakai kuota. biznet lg jahanam..,negative
biznet kamu kenapa deh kok makin jadi kaya tetangga sebelah ,negative
woe biznet dari siang mati di dursaw. gecee laa gabisa maen palo ni,negative
komplain biznet ngechat ke bizpark.,neutral
kalo di kota paling bener pake biznet kalo pas aku di desa pilih beli paket im gb ga abis mau dipakai tiap hari cepet pula,neutral
biznet gak jelas! pagi pagj dah kek tai gangguan terus anjing. emosi,negative
biznet mulai ya berulah,neutral
gimana ya daerah rumah gua bnr full semua pake indihome ga terjangkau biznet firstmedia juga,neutral
 kle biznet daerah kalian gangguan gk?,neutral
wifi di daerah rumah cuma ada pilihan stmedia ama indomie. udah stress bgt sumpah. wahai biznet kenapa cuma sampe citra raya doang tigaraksa kapan,neutral
sekalinya bisa stream halal indihome sedangkan disini pakenya biznet hih ada aja siee,neutral
harusnya kalau biznet gangguan kompensasi untuk pelanggannya dipotong pembayarannya.,neutral
wifi biznet kenceng tidak? so far aku research yang paling menarik untuk aku tinggal dan buka studio itu di bsd dan nampaknya di sana bisa pakai biznet,positive
kayanya langganan biznet netflix hotstar hbogo mendingan deh dibanding first media. toh tv berbayar nya juga gapernah di tonton,positive
biznet lgi kenapa sih anjng nyala mati mulu,negative
mau pindah indipret tp pelayanan nya ga memuaskan skrg biznet rajin error,neutral
kenapa lagi lah si biznet ini,neutral
hadeh lagi kritis gini malah ngelag woe biznet ada ape lu,negative
hut ri biznet hadirkan berbagai alternatif layanan ,positive
yah biznet gaada di daerahku,neutral
biznet masih gangguan ini area denpasar doang apa se indonesia?,neutral
terimakasih biznet wifi ku kembali..kan jadi gak panik yah entar malem vc sm ibu negara,positive
helo gengs ada yang punya kontak sales biznet? bagi dong,neutral
biznet kurang peka nih saya mau vc hari ini sm gracia tau pake acara ada kendala segala hadeh,negative
ga ke tolong wifinya brok. anjing ganti ke biznet aja kek,negative
sumpah biznet jgn berulah dlu dong asu,negative
semoga ada biznet di sini ya allah ,positive
info dong mutual gw yg pake provider biznet ini internet nya masih ga bisa ya?,neutral
halo biznet kenapa gangguan ya? ,neutral
sambut hari kemerdekaan biznet terus bangun infrastruktur digital ,positive
mau pasang wifi mending biznet atau benefit?,neutral
bentar ku masih denial kalau biznet lebih jelek dari indihome. wkwkwk,negative
 sama nih biznet dursaw mati juga,neutral
ada rekomendasi wifi yg oke ga selain firstmedia biznet? indihome ga dulu,neutral
biznet. beliau ini makin ke sini makin ke sana,neutral
duh asu biznet gangguan lg,negative
lama banget respon petugas biznet dari tgl komplin ke salesnya sampe sekarang belum di benerin payah,negative
 ajonx biznet masih bisa akses sih tp pake telkomsel dan se circlenya udah ga bisa,neutral
biznet mau sampe kapan? belakangan ini kok malah lebih jelek daripada yg merah ,negative
 tf ada yg tau nomor wa teknisi pemasangan biznet? kalo bisa yg mencangkup daerah pwt juga. makasii,neutral
halo saya sudah melakukan pengembalian perangkat dan bagaimana cara saya mengecek bahwa saya sudah berhenti berlangganan biznet home? terima kasih min,neutral
biznet gausah aneh aneh aku lagi nonton voli,negative
 technically true tapi default block all cuma bakal impact ke lingkup yang lebih lebar lagi sih mas blog pribadi small personal project bahkan website yg baru dibuat bakal inaccessible. i m just saying it s too risky. isp kayak indihome biznet bisa diamuk pengguna,neutral
jaringan internet bukan provider di semarang sekarang banyak ya. dulu tahunya biznet. sekarang ada firstmedia myrepublic mnc iconnect pln ..,neutral
sengaja bawa pulang laptop mau selesein kerjaan. tapi biznet gak bersahabat. tethering dr hp jg kenot. why why why ,negative
biznet terus bangun infrastruktur digital untuk masa depan indonesia thephraseid digital digitalization internet future ,positive
bentar lagi biznet masuk kampung. saatnya ganti ,positive
u bisa gak sehari aja jngn gangguan dsni kalo ada biznet mnding w pake biznet dah,negative
halo kak cek dm dong biznet error nih.,negative
mau ganti biznet tapi pas liat harganya bikin nangis,negative
daftar harga paket internet wifi biznet terbaru agustus ,neutral
habis kmaren nanya di chat biznet somehow hari ini web nya susah banget diakses pake si plat merah. pdhal nyoba di hape yang operator lain ke load dengan mulus apakah apakah,negative
 oh glad it was resolved! misal ini kejadian lagi coba juga pakai sebagai alternatif.,neutral
ini harus pake provider apa lagii anjrit udah pake telkomnyet masih aja buffering mulu tai wifi udah pake biznet masih aja reconect muluu bangs,negative
kalo dipikir pikir dari dulu biznet selalu mati di jam segini itu staffnya lg ishoma trs internetnya ikutan kah?,negative
biznet lagi gangguan di area bintaro. payah,negative
yaelah biznet berulah lagi capek bgt ini kalo bukan karena putus kontrak denda jt dari lama mah udah ganti emg denda ini akal akalan biar ga putus kontrak,negative
berikut ini rincian harga paket internet wifi biznet terbaru agustus berdasarkan daerah masing masing pelanggan. ,neutral
astageus udah paling bener gapake wipik di rumah amp udah paling bener kantor gw pakenya ntt ama softbank.. biznet aja pada gamau deh tuh jepun jepun rempong di kantor,negative
push rank sama temen sambil dengerin playlist favorit di youtube jadi lancar dengan koneksi internet biznet! pembayarannya mudah via virtual account bank bca resibca mudahpakaiprima,positive
ini biznet modar lg ya? langganan tiap weekend dan pelanggan pun ga dapet kompensasi. hebat biznet lanjutkan,negative
jujur sebagai pelanggan baru biznet yg gw tunggu adalah gw bakal complain apa ya? dah bulan blom ketemu . lah hari ini malah speed bandwith dinaikin secara gratiss alias zonder bayar. apa an ini? ya langsung test speed lah! hasilnya cocokk. mantep lu biznet noendorse ,positive
rumah gw pake provider laen pake biznet ,neutral
enaknya biznet libur lebaran gue biarin ga aktif soalnya gaada yg pake sejak april. mau gw aktifkan lagi sekalian pindah paket ke c mbps soalnya mau ada kerjaan yg butuh bandwidth lumayan gampang prosesnya. ,positive
ih jadi pengen ganti biznet ,neutral
goblok bngt anjing biznet ,negative
sekarang puredns tersedia juga lewat infrastruktur biznet gio cloud kamu bisa pakai dns over https tls menggunakan url berikut let me know if it works!,neutral
emang gak main main ini wifi ghz langganan mbps biznet bisa dapet mbps racun dari ,positive
akhirnya mereka mau narik kabel masuk gang rumah marhaban ya biznet ,positive
assalamualaikum biznet lagi main ngelag anjrot ,negative
markicob kita liat pake biznet bulan pertama bakal gini terus ga ya ,neutral
fifa mk dons road to glory negosiasi transfer tiga pemain muda free agent uploadnya lama banget karna internet saya biznet down dari kemarin siang. durasi panjang selamat menikmati akhir pekan! wearecjm careermode fifa ,negative
kapan ya di rumah bisa ada biznet,neutral
biznet banting harga untuk daerah di luar jadetabek surabaya denpasar dan badung. ,positive
instances di biznet ada di lokasi jakarta dan jawa barat. so pengguna yang di jawa barat bisa pakai endpoint ini untuk encrypt dns query mereka.,neutral
biznet tingkatkan kapasitas bandwidth untuk layanan biznet home ,positive
dari pagi biznet lambat bgt prasaan,negative
biznet tingkatkan kapasitas bandwidth untuk layanan biznet home ,positive
biznet tingkatkan kapasitas bandwidth untuk layanan biznet home ,positive
orang tuh ada ya yang mau ngatain orang serandom ini kaya bisa gitu kepikiran payung biznet,neutral
biznet masih down. saya harus upload video size gb pake internet speed mbps kelarnya kapan astaga.,negative
 gkmauu berantem sama pyung biznet,neutral
kadang biznet kalau hujan gini suka gembel deh koneksinya,negative
biznet ulah apa lagi,negative
men neked akses jaringan biznet mending jauh biznet jik.,negative
biznet nih kalo ujan mulai deh. kek sampah,negative
akhirnya ada biznet,positive
ada yang pakai biznet home di sini? saya baru aja deploy puredns di neo penasaran apa ini bakal ngehasilin koneksi yang lebih baik kalau sama sama biznet. untuk yang mau coba reply ya!,neutral
biznet kalo ujan kok ky tai yah,negative
pasang biznet tinggal lewat website kan? info dong,neutral
ayolah biznet merapat boja dan sekitarnya tuloong,neutral
komputer cepat watapa kalo ping biznet masih k,negative
biznet ni jos sekali udah kenceng stabil gak ada fup,positive
kebetulan banget biznet baru masuk komplek gw tapi keselnya bulan baru perpanjang mnc setahun,negative
biznet terpantau kurang stabil gt . lt ,negative
biznet kenapa dah?,negative
terbiasa pake biznet sekali keluar sinyal tsel bapuk bgt,negative
biznet nya ngadat lg kyknya ini,negative
saatnya mengatakan biznet anjing,negative
biznet kostan gue knp berbeda y,negative
 kle semeton biaya pasang biznet berapa ya?,neutral
 askrl gaes yang rumahnya area depok citayam pada pake wifi apa? indihome firstmedia myrepublic biznet ada yang lain yang bagus? makasi,neutral
biznet lagi gangguan kah?,negative
internet udah biznet sama firstmed semua ping gaada yg bener packet loss persen bodoh,negative
oalah emang kemarin biznet down bayangin udah nanya di zoom tp pas dijawab sm speaker malah kelempar keluar. jadi apa jawaban dari pertanyaanku kemarin ya,negative
jyp wifinya monmaap ganti biznet aja,neutral
 askrl ini kenapa aneh ya.. buka ig ga bisa pake wifi.. ngeload doang gtu tpi pake data seluler baru bisa.. wifi aku biznet btw.. ada yg sama ga ya??,negative
biznet ngepet rto mulu,negative
biznet gangguan ya?,negative
bang ,neutral
biznet mesti bgt ,negative
biznet gangguan mulu babi,negative
monmaap biznet u kenapa deh gue lg ngelive anjir,negative
indihome kalo masih bermasalah tapi harganya masih mahal gua urus pindah biznet ini,neutral
 titipan rek disini ada sales wifi my republic biznet ? mau pasang wifi area taman apsari kalo ada rep ya nanti di dm. terima kasih,neutral
 lmao lu disuruh pakai biznet,neutral
xl amp biznet janjian apa gimana si,neutral
masak sih enggak ada? malahan biznet melsa myrepublic udah masuk semua loh,neutral
biznet belakangan ini sukanya putus nyambung putus nyambung ya. ada masalah hidup apa deh ni wifi satu,negative
pantes ajah biznet jlek taunya mati lampu,negative
kudu berapa rumah mau masang biznet sih area yg masuk cuma si merah huh,negative
mau ngedumel sumpah serapah soal biznet yg lg lemot tp sadar ini tempat mencari makan jugak,neutral
kalo login ig pake face id sering error gak sih? atau emang biznet sama indih me gue aja yg bapuk ,negative
smi biznet lagi gangguan?,negative
saran dong lagu buat cover jgn yg terlalu indie yg bang gw pake biznet soalnya,neutral
fiuh biznet kembali normal tapi rdp encode lg ngambek hiks,negative
kabel biznet internet putus karena tersangkut truk via ,neutral
biznet kalo kena ujan lemah bgt y,negative
dahlah pindah ke biznet aja kali ya,neutral
alo guys kantor biznet buka jam berapa ya,neutral
ganti biznet tida ya,neutral
biznet kenapa nih tumben,negative
biznet kenapa seperti asu,negative
udah kalah ajah dah biznet jelek sinyalny,negative
info pasang biznet di tlogosari bisa ga si ,neutral
bt bgt biznet. sinyalnya lagi ilang ilangan lagi,negative
biznet kenapa dah buka figma youtube clickup gabisa buka netflix lancar,negative
