pengguna biznet kalian dr td malem pada gabisa akses twitter kalau pakai wifi ga..?,negative
 hai saat ini layanan biznet sdg terjadi indikasi gangguan penurunan performa koneksi ya khususnya di area jawa tengah jawa timur bali. semoga utk proses penanganannya bisa dipercepat. sebelumnya mimin sampaikan permohonan maaf atas ketidaknyamanannya. tks. yud,negative
biznet lagi error ya? kenceng amat upload gw ,negative
kecepatan biznet emang nggak main main ,positive
indihomie lagi bolot tbtb biznet muncul tak cek promo paket nya. cuk up to mbps rb yg mbps cuman rb tax dan tiang rumah depan ternyata tap point biznet ,neutral
top biznet nggak maen menit maennya detik . ,positive
oxygen sama biznet gamau masuk gdc? capek gua ama first media gaada gunanya ,negative
asli ini biznet ngapa deehh padahal pke lan ,negative
biznet paket termurah ,positive
biznet ya allah mahalnya doang sekarangg dulu ngedip aja udah selesai download file sekarang kok lemot banget ,negative
lur! apakah sudah ada yg menggunakan biznet ponorogo? katanya lebih murah cepat stabil dari indihome.. i ,neutral
biznet error hari di hari ke teknisinya datang bawa ini. dulu pas langganan f media error minggu boro dateng dibuat pengaduan malah bomat. pakebiznet aja ,positive
lihat selebaran depan pagar eh.. biznet.. cek dan cek ternyata udah ada tiangnya. liat paketnya lucu juga. salah satu hal penting juga ketika pilih rumah adalah cakupan internet. ,positive
biznet oh biznet ada apa denganmu ,negative
padahal uda th aku resign dari biznet. tapi masih banyak banget yang wa begini ,neutral
ini detik loh . pantesan tetangga semua pindah ke biznet. trnyt gini. ,positive
selasa posko ppkm mikro kelurahan demangan mendapatkan bantuan masker medis dari biznet jl laksda adisucipto sebanyak box.. dalam kesempatan tersebut bhabinkamtibmas mewakili posko ppkm mengucapakan terimakasih atas kepedulian manajemen biznet ,positive
ganti biznet coba pak jan pake indihom,neutral
bikin loading website smooth like butter biar jadijuara di hati pelanggan pakai neo web! hosting ngebut mulai k bulan! gratis migrasi bandwidth up to gbps backup link. selengkapnya cek atau s sh w pakebiznet bts butter bts ,positive
gak apa biznet jam segini aja masih error,negative
listrik down biznet down. terpaksa batal live streaming malam ini.,negative
biznet please jangan mota mati mulu lu h,negative
lowongan kerja biznet loker lowongankerja ,neutral
biznet sinyalnya tolol pas ujan doang deh kayaknya.,negative
biznet lagi ampas bgt ya beberapa hari ini,negative
pen pake biznet aja pemasangan indihome lama,neutral
gangguan x sehari dengan durasi yang lumayan lama biznet sedang tidak baik baik saja,negative
biznet murah bagus tapi kenapa rumahku ga ke cover,positive
biznet sekalinya ngeblangsak keterusan anjgg,negative
gpp biznet tiap hari aja sekarang errornya.,negative
biznet ngga stabil lagi yah ?,negative
biznet lg bapuk,negative
segala keributan ini kayanya buat ngasepin isu biznet koit sejawa bali udah hari.,negative
gak ada niat ngasih kompensasi apa gitu biznet? udah semingguan nih error mulu.,negative
buka web stream pake biznet suka gabisa terpaksa hrs pake vpn malah bikin lemot,negative
hey biznet anda gangguan mulu minggu ini tidak ada niat buat ngasi kompensasi apa gitu?,negative
duhh gemes banget deh liat tingkah lucu dari animarsh mau liat kelucuan mereka lainnya? nonton di goplay yaa karena biznet x animarsh bakal tayang season nya! jangan sampe ketinggalan yak! goplayindonesia biznet animarsh ,positive
kacau bgt sinyal biznet hari ini,negative
melihat pengguna biznet sedang mengeluh dan indihome lancar disini kadang saya merasa bangga,negative
untung je hari ini ngga ada kelas online kl ada harem ngakngiknguk dong ayo biznet kamu bisa,negative
makin burik aja nih gua liat sinyalnya indihome gnti biznet aja kali ya,neutral
di rumah biasa pake biznet yg ngebut di rumah umi make plat merah langsung pgn misuh ,neutral
cah biznet sama indosat lagi gangguan ya? thx yg udh jawab,neutral
biznet pun kembali normal,positive
biznet kenapa lagi si ah,negative
 terpopuler pln meluncurkan layanan internet iconnect dengan harga rp ribu hingga rp ribu. iconnect akan bersaing dengan indihome milik telkom biznet hingga first media. ,neutral
kalo sampe biznet masuk sukodono saya berhenti nakal.,positive
dm dengan cs biznet serasa sama temen sendiri bre,positive
biznet lagi down ya? dari pagi no internet nih internet di kantor gw zz,negative
hadehh wifi ku knp burek bgt ya biznet biznet km knp si,negative
pdg! saran wifi selain indihome sm biznet buat daerah koto tangah dong,neutral
biznet berulah lagi.,negative
mau saran kalo di mlg enaknya pake biznet indihome apa first media ya? askrl yang harganya paling murah apa,neutral
wifi biznet ngadet lagi knp sih,negative
oh c mon biznet sejengkal lagi padahal biar bisa ganti. dah muak bgt pake indihome tolol,positive
biznet ngadat apa gmn,negative
biznet oxygen id stroomnet ga ad yg masuk. nasib rumah di pelosok tanah air,negative
ini mahkota simprug dibayar brp dah sm biznet dan indihome buat ngehambat provider ky biznet dan my republic masuk ke sini,negative
biznet parah sih ud minggu berturut turut tiap kamis selalu sinyal nya,negative
hi min saya pengen langganan layanan biznet cuman masih bingung soal kepastian domisili. saya ada kemungkinan pindah kontrakan namun masih di area yogyakarta. mungkin g langganan biznet tapi tinggalnya pindah gitu?,neutral
indihome error ? firstmedia aman ni pake dua ini karena terpaksa coba biznet dan oxy bisa disini huft,positive
ini biznet lemot tsel lemot semua lemot,negative
woi anjing wifi gua goblok ansos bgt nih gapunya kuota ,negative
 hari ini biznet lg trouble cukup parah tp surprisingly netflix nya masih cukup lancar,negative
dah ga heran indihome eror jam segini tiap hari dah biasa.ganti lah biznet gas,positive
kecuali kelas doang si soalnya semua kelas dikasi wifi tapi kelas nya terlantar bisanya dapet wifi biznet dari perpus bawah. emang nasib kelas pojok,neutral
udah ganti biznet ini w rasa,positive
biznet ni nak engken sih,negative
biznet siang ini lelet banget si,negative
 biznet belum masuk situ rang?,neutral
biznet di gym ngebut tp kenapa biznet dikosan bapuk ya pdhal msh satu area.,negative
info kos cowok campur yg bisa pasang internet kabel preferably biznet sendiri dong,neutral
dipikir pikir salesnya biznet iki rodo lentho kok. ditanyain promo pembayaran bukannya kenceng ngasi info malah lho saya pikir ibu sudah tau . gini ini kalo produk kepayuen jadi kurang approach jemput bolanya.,negative
pengen ganti biznet tapi belum bisa.,neutral
udah biznet kayak eek lagi,negative
gpp sih lambat sekarang asal jam ntar lancar lagi ya biznet,neutral
biznet isp terbaik tidak pernah maintenance setara dengan indihome saat normal,positive
 kle knpa sih dengan biznet ini? gangguan terus anj,negative
 askrl biznet atau myrepublic?mo berali dari indirumah soalnya,neutral
biznet di denpasar makin kacrut aja akhir akhir ini.,negative
mau indiehome kayak eek lbh eek an biznet anjir,negative
wah biznet udah masuk tanjung barat nih ,positive
sobat biznet apakah sedang ada gangguan? ,neutral
biznet syg. update lol wr . gb dari siang sampe sekarang baru . cek di kecepatannya diatas mbps tapi pas donglot cuman kbps. pingnya diatas ms pas maen game. ada apa gerangan ,negative
sales nya biznet kalau kata pak honor bungut dagang kali,negative
biznet genjot penjualan via promo back to school indotelko ,positive
biznet pls lo ada masalah apansie ajskskdldl,negative
indihome down. di kantornya pake biznet kali ya biar bisa onlen?,neutral
jujur biznet lemot bgt,negative
biznet lagi kenapa sih,negative
ni biznet gardunya meledak apa gimana dah ngelag bener,negative
anyway koneksi biznet udah balik belum ya semeton bali? kayak udah tp ngga yakin,neutral
 boleh aja menyediakan jasa internet home dan office ntuk perusahaan plat merah catatannya kualitas jasa yg d berikan harus optimal jangan kyk yg saat ini gajelas pantesan aja kalah sama sekelas biznet mnc fisrt media dll cuma jangan semuanya main,negative
biznet jgn lemot dulu ya,negative
tanggapan biznet untuk surat pembaca bpk ibu ariyawira binui ,neutral
ada apa dengan biznet? beberapa hri terakhir di denpasar bali sinyal sangat lelet. segera di tindaklanjuti. biznet,negative
 tf ada yang punya kenalan atau punya nomer cs nya biznet tegal gak ya? mau tanya ttg wifi. makasih,neutral
wifi biznet ter the best pokoknya mwah ,positive
oh iya dinkotrak saya kan ga ada penalty ya kalo pemutusan internet soalnya ada yang ada ada yang engga teman saya saya mau pindah pake biznet aja klo gini terus mumpung sudah masuk daerah saya dan lebih murah dan ga ada fup juga ,positive
aku tadi memanggilmu wahai gadis berhelm biznet,neutral
 rek ada yang make biznet ga buat wifi rumahnya? lek misal daerah ku durung ter cover jaringane ada tambahan lagi ta lek mau pasang?,neutral
karena sinyal yang tiarap hari hari ini dan besok kita ga bisa upload konten commartg. rencana live besok juga kayanya batal. kecuali secara ajaib biznet pulih besok pagi.,negative
internet biznet di manado sangat mengecewakan cc ,negative
oi lagi ngejar deck masa iya mati lagi sih nih internet. dari kemaren gini terus. halo kalo mau mulai langganan mesti hubungin kemana yah? mau ganti dari first media ke biznet nih.,positive
hi knp tdk bs byr asuransi allianz d permatamobilex ? pdhl polis yg saya input sdh bnr byr tagihan biznet home jg tdk bs,negative
promo khusus biznet home untuk tunjang pjj ,positive
 hai untuk layanan biznet sudah menggunakan ipv bisa diinformasikan kendalanya saat ini. thanks rzk,neutral
makin diminati okupansi biznet data center fase i hampir penuh ,positive
 terima kasih atas ketertarikannya terhadap layanan biznet. apakah bisa di informasikan melalui dm alamat lengkap nya seperti nama jalan nama kota kelurahan dan kecamatan agar bisa kami lakukan pengecekannya. thanks rzk,neutral
to udah bermasalah lagi nih internet nya biznet sialan kenapa masih belum bisa diperbaiki juga sih biznet in indonesia speed performance outages and user reviews fing internet biznet via ,negative
to ada apa lagi sih ni biznet bermasalah lagi nih internet nya udah minggu nih biznet sialan biznet in indonesia speed performance outages and user reviews fing internet biznet via ,negative
promo back to school yang lebih ekonomis bagi pelanggan baru maupun eksisting ,positive
hingga karena samp biznet di indonesia kecepatan kinerja pemadaman dan ulasan pengguna fing internet biznet via ,negative
sampah nipu hingga karena samp biznet di indonesia kecepatan kinerja pemadaman dan ulasan pengguna fing internet biznet via ,negative
biznet km kenapasih!,negative
santai dikit la kencang amat biznet ,negative
selamat pagi semua dari pengguna biznet ,neutral
love biznet bgt walau mahal tapi speed nya segini wkwk ,positive
paket biznet home termurah cmn . dapet segini. dulu firstmedia bayar . . boro upload segitu ,positive
biznet gangguan lg ya,negative
ganti dari indihome ke biznet kirain ada perkembangan gataunya sama saja,negative
kalo baru mulai bikin website dan bingung mau bikin yang seperti apa tipe website di bawah ini bisa jadi referensi kamu. kamu prefer yang mana nih? pakebiznet website hosting indonesia ,neutral
besok pasang biznet yuhu babai firstmed internetku selama tahun ini,positive
tolong dong perluas area segera terakhir info masih pengajuan izin istansi setempat. saya mengajukan area dari th lalu terpaksa pakai firstmedia dan disabar sabarin tapi jaringan biznet belum masuk. jl raya yg terlayani biznet k rumah itu padahal kurang dr km loh ,neutral
biznet wkwkwkw,neutral
hari ke puasa masih semangat gak nih? biar gak lemes lemes amat di bulan ramadan mending ikutan kuis ramadanunlimited hari kedua di akun instagram neo cloud langsung aja ikutan semoga beruntung! pakebiznet indonesia hosting ramadan ramadan ,positive
sambil ngabuburit mending ikutan kuis ramadanunlimited di akun instagram neo cloud dan dapatkan saldo ovo go pay rp . masing masing untuk orang pemenang! yuk ikutan jangan sampai kelewatan ya! pakebiznet indonesia hosting ramadan ,positive
biznet di rmh napa tiba mati dah,negative
dari pagi biznet tiba mati gak tau kenapa. dah gitu tadi bocah minta dipasangin cocomelon. w bilang aja tvnya lagi sakit jadi bobo dulu wkwkwkwkwkwk,negative
bohong pake biznet lancar buka google,positive
ayo biznet you re my last hope di jakarta pun ga semua daerah kecover provider internet fak,neutral
halo pada bukti bayar masih ada promo tahun nih yang males rubah tahun bagian mana di biznet om ? ea ,negative
pake biznet yg berapa duit ini mas ?,neutral
tidaakk biznet lagi gangguan,negative
hari biznet pingnya terbang ngentot,negative
biznet ini kenapa sih. dari semalam loh.,negative
shombhong amadh yg pake biznet,positive
biznet agaknya flop,negative
makanya pake biznet yakan her ,positive
bawa formulir biznet wkwkwkwk,neutral
biznet tuh bagus ga si,neutral
jaringan wifi biznet gajelas bgst,negative
ulangtahun kayanya minta wifi biznet aja jovan ,positive
abang biznet kerjanya lama bener ini mau eek gw dari jam masang internet gak selesai selesai ,negative
budak! biznet gangguan ke?,neutral
sayapernah langganan cbn setahun tagihan tetap setiap bulan saya langganan biznet setahun tagihan tetap setiap bulan tapi saat langganan indihome tagihan bervariasi tiap bulan.,neutral
mau ganti myrepublic xlhome biznet semua gak bisa. cuma bisa fucking firstmedia indihome. ini adalah salah satu motivasiku untuk beli rumah sendiri ,negative
ya tuhan biznet kok lama kaya indihome,negative
biznet kapan masuk area gw,neutral
saatnya melobi untuk memakai biznet.,positive
kemarin sambungan internet dari first media mati dari jam pagi sampai jam sore. hari ini mati lagi. apakah ini waktunya beralih ke biznet atau my republic? mending yang mana ya? ada saran?,neutral
biznet merah tros,negative
gaes. provider wifi yg bagus apa? myrepublic biznet ama mnc play kagak masuk wilayahku ,neutral
cah arep nitip. dear mas mas kaos abu sing wingi nek angkringan ngarep biznet let me capture your smile,neutral
pengen langganan biznet tp blm kecover areanya,neutral
gaes yang apke biznet tagihannya berapa y sebulan?,neutral
biznet lagi kenapa sih?,negative
cah biznet opo lagi error? nggonku kok kat isuk gaiso jare teknisine dicek tapi gak enek kabar,negative
dan seringnya kalo ketemu internet kenceng pasti dari biznet.,positive
indihome anjing ayodong biznet perluas jaringan lu jangan menang bagus dan murah doang biar gua bisa cabut indihome ini jancok,positive
ganti biznet aja mas ndak pakai indihome ndak berarti ndak bangga ama almamater kok,positive
bodo amat besok aku mau ke biznet,neutral
guys biznet bagus kan ya,positive
hi tim biznet. routernya bisa toba tiba hilang sinyal. jd koneksi dr hp tiba terputus. apakah bisa dicek? krn routernya sendiri umurnya sudah dr awal pasang biznet,negative
kubersyukur masih pake biznet,positive
gara gara indihe error ini sodara gue di jakpus sampe ganti pake biznet separah itukah indihe,positive
ya sudahlah ganti first media ke biznet,positive
emosi bgt sm biznet,negative
biznet isi trouble bisa tiap hari ada masalah apa sih kalau ada masalah jangan dipendem pendem mending ceritain aja,negative
biznet nangis dikasih ujan padahal ga gede,negative
biznet belom sampe desa sucii bingungg mo pasang apaahh. tolong yang di gresik rekomendasinya apaah? ,neutral
yaelah gangguan lagi biznet. plis jangan sampe siang entar gue kerja gimana,negative
gue kangen biznet an di lorong,positive
biznet pun hanya tersedia di kalsel kalteng.. ga mau ke kaltim apa,neutral
biznet kgk jls,negative
baru tau di bondowoso dah ada kantornya biznet apa pindah biznet ya,neutral
monyet biznet kenapa pake eror sgala,negative
wahai kenapa dari semalem trouble terus?? kalo kaya gini mulu gua pindah biznet apa xlnet aja dah,positive
bener bener mati anjg ini biznet fak,negative
gw dah nyoba mnc firstmedia oxygen indihome dan yg kuat stabil dibawa live p di yutub cuma indihome anjir aneh yak wkwkw jangan bilang biznet kaga ada sama my rep juga kaga ada,positive
biznet genjot pengguna biznet home indotelko ,positive
sialan ngadat bgt biznet ini gegara bocil pada ml an didepan anjer,negative
entah kenapa attacker mu di nd half kaya connection nya pake biznet ajg lancar. babak pertama kaya firstmedia,negative
oh biznet ini menjembutnya pas pagi ya. mesti ada drop menitan. ya gapapa sih asal nggak pas meeting aja su.,negative
akhirnya biznet lewat komplek rumah. slot marah ke provider jadi berkurang,positive
ini biznet xlhome oxygen mnc kaga ada yga mau masuk komplek gua apa firstmedia goblok bgt inet nya,negative
ada masalah apasih ini biznet sama line ya allah ada aja agenda mancing tiap hari,negative
akhirnya setelah beberapa lama diphp sama teknisi indihomo pilihan jatuh ke biznet moga lancar dan ga ada gangguan.,positive
selain indihome first media biznet provider wifi apalagi deh??,neutral
cah seng daerah gurah kalian biar bisa wifi an pake apa? soalnya setauku biznet blm bisa dipasang,neutral
kenapa biznet jadi jelek ya review orang orang.,negative
sedih bener biznet blm cover wilayah rambutan,negative
biznet ini ya aku perhatiin setiap minggu jam jam segini internet nya jem,negative
pemkot depok terima bantuan dari biznet ribu masker medis dan wifi ,positive
biznet gio kembangkan data center ketiga ,positive
yang bikin kangen kantor koneksi internetnya. why oh why biznet ga masuk daerah w,negative
wifi ku merek biznet saiki error nang wifine ono ono lampu kedip abang pas tulisan los info dong rek,negative
ga biznet ga tether telkomsel pada mabok semua koneksinya buat stream.. why minggu minggu begini malah gangguan ih.,negative
mimin cek dm yaw biznet bisa diputus sementara ngga sih min? kontrak tinggal bulan jatuh di bulan juli tapi pengen diputus bulan dulu tanpa kena pinalti bisa?,neutral
bintaro nians ada yg pakai biznet? how s it? sepertinya indihome sektor mulai tidak reliable.,neutral
udah disconnect kali dari semalem.. bayaran bulanan gue angsur x kali ya? biznet mana biznet,positive
sepupu aing anak smp kelas build pc jt. internet bulanan jt biznet. dipake main roblox. doang. udah.,neutral
 biznet oke? gw belum pernah pakai untuk rumahan..,neutral
firstmedia bertingkah biznet segeralah ke pondok gede,positive
biznet dah enakan belum om ,neutral
kapan deh biznet masuk area rumah aku.. udah senep banget sama yang susah stabil. cc mas ,positive
biznet lg promo bayar bulan di muka gratis bulan! kalo ada uang mending dipake promonya. lumayan bs hemat rb smpe akhr tahun,positive
guyz info wifi buat di rumah selain firstmedia biznet myrepublic dan indihome apa ya?,neutral
gokar! adaa yang pake wifi nya biznet?? mau berlangganan kemana ya cabangnya?,neutral
jog! ada yang udah pake biznet di rumah? recommended gak?,neutral
yang sering gangguan pake first media monggo beralih ke provider lain yg lebih bagus kaya biznet myrepublic atau oxygen. gue pake oxygen udh setahun gangguan baru x karna ada kesalahan teknis. abis telpon langsung dibenerin ama teknisinya. dari mantan user fm ,positive
brengsek nih admin biznet slow respon bgt tiap ada kendala. kalo di mola udah sp ini adminnya wkwk,negative
jadi kemarin jaringan biznet keputus terus becandaan ama bilang jangan kabelnya diputus ama provider tetangga yang lagi masif bener promonya nih. eh lho kok teknisinya tadi laporan di whatsapp kalo jaringannya bermasalah karena kabelnya putus beneran ,negative
trending nya indiehome lemot padahal emang servernya google yg down lah aku di kantor pakai biznet malah lebih parah lemot nya terpaksa paket data,negative
biznet dukung vaksinasi di banjar tengah renon lewat ,positive
leh biznet ning magelang kantore ning ngendi yo kok golek ning gmaps ora ana? apa ana saran lain selain indihome ora meh pasang wifi tp bingung iki wkwk,neutral
kalo aja bisa ganti server jd biznet atau xl home. sayangnya di sini cuma bisa indihome. huf. bayar mahal tp jaringan ga pernah bisa stabil. padahal rumah letaknya juga di pinggir ringroad. bukan di pelosok. gimana nih?,negative
 . ternyata selain indihome biznet juga sperti babi,negative
biznet bangun pusat data ketiga di indonesia terbaru berita lifestyle live,positive
implementasi g biznet kena dampak? ,neutral
hai apakah untuk area pekayon bekasi selatan sudah bisa menikmati akses internet dari biznet?,neutral
biznet apex legends cannot connect game laen pdhl lancar jaya. di rumah lancar maen apex.. team esports yg kolab sm biznet gmn y apa ada tim apexnya? apa pake biznet buat maen apex? rrq,negative
biznet kacau nih kalo kalian mau pake biznet coba pikirin lagi deh. semenjak ganti tahun dan merambah ke tv cable layanan internet biznet lebih sering down dan ngerugiin. gue jadi mikirin opsi ganti provider.,negative
 hai terima kasih atas ketertarikannya terhadap layanan biznet. apakah bisa di informasikan untuk layanan hunian atau perkantoran dan informasikan alamat lengkap seperti nama jalan nama kota kelurahan dan kecamatan agar bisa kami lakukan pengecekan. thanks rzk,neutral
 hai setelah kami koordinasikan kebagian tim kami saat ini terdapat kendala pada sisi jalur distribusi yang mengarah ke lokasi sehingga berdampak tidak tersedia layanan biznet masih dalam penanganan oleh tim kami. mohon maaf atas ketidaknyamanannya. thanks rzk,negative
biznet pernah punya data keluhan konsumen ga sih.harusnya tercatat pelanggan yg tiap bulan complaint pdhl udah taun langganan yg kelas sultan pulak dulu langganan akun skrg tinggal eh ga kapok service nya masih kelas abal ,negative
khusus april juni biznet menghadirkan promo pakebiznet lebih cepat! lebih cuan! ,positive
melalui promo ini pelanggan akan mendapatkan kesempatan memenangkan hadiah grand prize berupa uang tunai jutaan rupiah. ,positive
testing koneksi biznet pasca badai. ,neutral
biznet kapan ya layanannya bisa masuk ke daerah rumah aing ,positive
udah restart modem router x lebih. speedtest aman sejahtera tapi kalo ke aws selalu kek bangsat. dipersilakan protes ke indihom region masing masing. sedikit good news kabarnya biznet mulai masuk ke daerah gua. in the upcoming months gua bakal usaha lagi buat ganti isp. ,positive
thx biznet telah mengabulkan pengandaianku tahun lalu. ,positive
biznet bulan free bulan ternyata harus beli modem wkwkw sebenernya harganya bakal sama kayak existing user yg bayar dapet ,negative
cah yang pake biznet real gak iki biaya bulanan e ? pict dpet dri google ,neutral
perluas jaringan layanan biznet tebar promo menarik di bali ,positive
apaan sih biznet? ,negative
biznet membuka lowongan kerja sebagai area coordinator penempatan di badung gianyar denpasar klungkung singaraja dan tabanan lokerbali z,neutral
saat hujan petir justru kecepatan biznet seperti ini. ,positive
 df belum rezeki pdhl udh x ikut gni trus wkwk apakah saia harus ganti iphone wifi biznet ,neutral
semalem biznet maintenance sampe subuh. mati kutu gak bisa ngapa in termasuk streaming bola. gpp. yg penting liverpool menang! ynwa ynwajurgen ,positive
laf yu biznet bangun pagi tadi maintenis dah beres ,positive
min saya lagi di istana bec bandung saya cek ada wifi biznet tapi kok gini ya? mungkin aja mimin bisa bantu kinpq l,neutral
gong xi fa cai! selamat tahun baru imlek bagi teman teman yang merayakan. semoga tahun kerbau logam ini membawa kesehatan dan keberuntungan bagi kita semua. staysafe dirumahaja pakebiznet imlek chinesenewyear ,positive
may all indonesian content creators and virtual youtubers yang masih terjebak dengan rumah indi bisa ganti isp secepatnya. ya minimal cbn biznet,positive
terima kasih buat siapapun yang sudah mendukung saya untuk mendapatkan internet gratis setahun!! pakaibiznet anda juga bisa ikut berpartisipasi yaitu dengan cara mendaftar biznet dengan memakai referal code tolong abaikan kesalahan penulisan nama saya ,positive
menurut speedtest biznet menjadi provider internet broadband tercepat di tanah air mobitekno speedtest intelligence speedtest by ookla layanan web yang menyediakan analisis metrik ,positive
biznet akhir ini lg gila ato cm di tmpt w doang?,negative
grgr biznet modar terpaksa tethering,negative
tuolong biznet balik normal ak mau nonton sbgn,negative
biznet lapo si lelet bgt,negative
biznet ayo dong masuk wilayah berbah banyak yg mau loh kenapa tida e and fibernya ,positive
biznet knp si menyebalkan sinyalnya. udh hari loh!,negative
edan lemot tenan sui tak ganti biznet ,positive
telyu! biznet nyampe sukapura nggak?,neutral
guis sinio angkringan biznet wkwk,neutral
karangasem kota bagusan pake indihome apa biznet ya,neutral
angel temen yaa arep masang wifi. xl home biznet ra tersedia ng kene indihome dela trouble. oalahh sewonderland,negative
huu biznet belum masuk pengadegan,negative
biznet ngapadah,negative
ada yg pake biznet ga? bagus ga?,neutral
bye indihome abis ini aku beneran ganti pake biznet,positive
lagi ujan biznet jelek bngt jrot,negative
biznet kok jadi rese ya skg,negative
biznet kebangetan. wifi mati sore sore gini,negative
mau ganti biznet baru ada bulan depan,positive
 cara berlangganan biznet di bangli ,neutral
ternyata kos pakai biznet pantesan stabil parah,positive
tanggapan biznet untuk surat pembaca ibu inneke kamasi ,neutral
 dikau keluar biznet? what s next?,neutral
pandemi dorong biznet ekspansi ke sektor kesehatan ,positive
hei biznet kurang meter aja buruan pasang tiang baru dong disini cuma ada jaringan plat merah. gak pengen takeover pelanggan disini apa ,positive
biznet menjadi provider internet tercepat di indonesia ,positive
kalo aja biznet ga mahal kalo aja citra xl firstmedia bisa masuk pandega kan gaperlu pake indihome ,positive
